id,title,authors,year,abstract,keywords,journal,doi,source_db,country,citations,url
CR_10.1177/01655515241293775,Evaluating public sector employee perceptions towards artificial intelligence and generative artificial intelligence integration,Luca Giraldi; Luca Rossi; Edyta Rudawska,2024,"This study investigates the emerging field of innovative technology applications for public usage, focusing on employee perspectives. The research employs a questionnaire-based approach, collecting responses from 439 participants and examining demographics, technological proficiency, utility perceptions, personal data concerns, attitudes towards artificial intelligence and generative artificial intelligence, and willingness to endorse technology adoption. The data analysis minimises discrepancies between predicted and actual values through multiple linear regression. In addition, statistical methods such as Spearman’s ρ, the Wilcoxon–Mann–Whitney test and chi-square statistics are employed to consolidate the findings, ensuring the thoroughness and validity of the research process. The results indicate a positive inclination among participants to perceive artificial intelligence as augmentative rather than a replacement in public usage contexts. The research’s originality lies in the unique contribution of employees to technology adoption and strategic knowledge asset renewal for the management in the public domain.",,Journal of Information Science,10.1177/01655515241293775,CrossRef,"University of Macerata, Italy",7,https://doi.org/10.1177/01655515241293775
CR_10.37547/tajiir/volume08issue01-09,The Evolution of Product Management Methods in the Era of Generative Artificial Intelligence,; Shankar Krishnan,2026,"The article presents a comprehensive analysis of how generative technologies transform product management methods across different stages of the product lifecycle. The study is based on a systematization of modern approaches to applying generative models in ideation, user research, requirements formation, product design, go-to-market preparation, and post-release processes. The paper examines mechanisms that ensure the stability of decisions, including the use of synthetic data, scenario modeling, automation of analytical procedures, and agent-based coordination schemes. Particular attention is given to the asymmetry in method maturity, the impact of data quality on the reliability of conclusions, the requirements for interpretability, and the organizational constraints inherent in corporate environments. The analysis demonstrates that generative technologies reshape not individual stages but the structure of the entire product cycle, creating a continuous decision-making loop and redistributing responsibilities between analytical and engineering functions. The study concludes that the effectiveness of generative models is determined by the coherence of data, architecture, and development processes, which sets new requirements for integrating these technologies into complex products. The article will be useful for product management professionals, AI researchers, digital platform architects, and developers of corporate systems.",,The American Journal of Interdisciplinary Innovations and Research,10.37547/tajiir/volume08issue01-09,CrossRef,,0,https://doi.org/10.37547/tajiir/volume08issue01-09
CR_10.3390/math11112451,A Mathematical Interpretation of Autoregressive Generative Pre-Trained Transformer and Self-Supervised Learning,Minhyeok Lee,2023,"In this paper, we present a rigorous mathematical examination of generative pre-trained transformer (GPT) models and their autoregressive self-supervised learning mechanisms. We begin by defining natural language space and knowledge space, which are two key concepts for understanding the dimensionality reduction process in GPT-based large language models (LLMs). By exploring projection functions and their inverses, we establish a framework for analyzing the language generation capabilities of these models. We then investigate the GPT representation space, examining its implications for the models’ approximation properties. Finally, we discuss the limitations and challenges of GPT models and their learning mechanisms, considering trade-offs between complexity and generalization, as well as the implications of incomplete inverse projection functions. Our findings demonstrate that GPT models possess the capability to encode knowledge into low-dimensional vectors through their autoregressive self-supervised learning mechanism. This comprehensive analysis provides a solid mathematical foundation for future advancements in GPT-based LLMs, promising advancements in natural language processing tasks such as language translation, text summarization, and question answering due to improved understanding and optimization of model training and performance.",,Mathematics,10.3390/math11112451,CrossRef,"School of Electrical and Electronics Engineering, Chung-Ang University, Seoul 06974, Republic of Korea",24,https://doi.org/10.3390/math11112451
CR_10.1093/bjrai/ubae012,"Clinical applications of generative artificial intelligence in radiology: image translation, synthesis, and text generation",Zhiqi Zhong; Xueqian Xie,2024,"Abstract 
                Generative artificial intelligence (AI) has enabled tasks in radiology, including tools for improving image quality. Recently, new hotspots have emerged, such as intra- or inter-modal image translation, task-specific image synthesis, and text generation. Advances in generative AI have facilitated the move towards low-dose, cost-effective, and high-quality radiological image acquisition. Large language models can aid radiologists by generating professional answers and facilitating patient-physician communications. However, radiologists must be aware of potential inaccuracies in the generated content and should only use such tools after rigorous validation of their performance.",,BJR|Artificial Intelligence,10.1093/bjrai/ubae012,CrossRef,"Radiology Department, Shanghai General Hospital, Shanghai Jiao Tong University School of Medicine , Shanghai 200080, China",3,https://doi.org/10.1093/bjrai/ubae012
CR_10.37547/tajiir/volume08issue01-09,The Evolution of Product Management Methods in the Era of Generative Artificial Intelligence,; Shankar Krishnan,2026,"The article presents a comprehensive analysis of how generative technologies transform product management methods across different stages of the product lifecycle. The study is based on a systematization of modern approaches to applying generative models in ideation, user research, requirements formation, product design, go-to-market preparation, and post-release processes. The paper examines mechanisms that ensure the stability of decisions, including the use of synthetic data, scenario modeling, automation of analytical procedures, and agent-based coordination schemes. Particular attention is given to the asymmetry in method maturity, the impact of data quality on the reliability of conclusions, the requirements for interpretability, and the organizational constraints inherent in corporate environments. The analysis demonstrates that generative technologies reshape not individual stages but the structure of the entire product cycle, creating a continuous decision-making loop and redistributing responsibilities between analytical and engineering functions. The study concludes that the effectiveness of generative models is determined by the coherence of data, architecture, and development processes, which sets new requirements for integrating these technologies into complex products. The article will be useful for product management professionals, AI researchers, digital platform architects, and developers of corporate systems.",,The American Journal of Interdisciplinary Innovations and Research,10.37547/tajiir/volume08issue01-09,CrossRef,,0,https://doi.org/10.37547/tajiir/volume08issue01-09
CR_10.1177/01655515241293775,Evaluating public sector employee perceptions towards artificial intelligence and generative artificial intelligence integration,Luca Giraldi; Luca Rossi; Edyta Rudawska,2024,"This study investigates the emerging field of innovative technology applications for public usage, focusing on employee perspectives. The research employs a questionnaire-based approach, collecting responses from 439 participants and examining demographics, technological proficiency, utility perceptions, personal data concerns, attitudes towards artificial intelligence and generative artificial intelligence, and willingness to endorse technology adoption. The data analysis minimises discrepancies between predicted and actual values through multiple linear regression. In addition, statistical methods such as Spearman’s ρ, the Wilcoxon–Mann–Whitney test and chi-square statistics are employed to consolidate the findings, ensuring the thoroughness and validity of the research process. The results indicate a positive inclination among participants to perceive artificial intelligence as augmentative rather than a replacement in public usage contexts. The research’s originality lies in the unique contribution of employees to technology adoption and strategic knowledge asset renewal for the management in the public domain.",,Journal of Information Science,10.1177/01655515241293775,CrossRef,"University of Macerata, Italy",7,https://doi.org/10.1177/01655515241293775
CR_10.18061/ojsm.6575,Artificial Stupidity: Generative Artificial Intelligence Chatbots' Inability to Multiply,Amanda Gantt Sawyer,2025,"We explored seven Generative Artificial Intelligence (genAI) chatbots to determine their ability to solve a multiplication problem and found that only one solved the problem without mathematical error. From these results, we explore the mathematics created by the genAI’s response to determine its mistake and why it could have difficulty with mathematical concepts.",,Ohio Journal of School Mathematics,10.18061/ojsm.6575,CrossRef,,0,https://doi.org/10.18061/ojsm.6575
CR_10.62517/jike.202304203,Study on the Attribution of Rights in Generative Artificial Intelligence Works,Jiacheng Jiang,2023,"In modern life with ever-changing science and technology, artificial intelligence has become more and more popular, existing in all aspects of people's lives, playing an important and difficult to replace role. However, the lag of the law leads to the fact that it can not solve all disputes, especially in the copyright ownership of artificial intelligence works, whether it is infringement, contract disputes or copyright protection. It is an urgent problem to be solved. Because most of the disputes in the present stage of artificial intelligence are in the aspect of economic property, this paper discusses the ownership of the rights of works from the perspective of law and economics and economic principles. Based on the incentive principle in economics, the feasible path in academic research and the subject of legal responsibility, this paper should ascribe its rights to investors. However, in order to avoid conflicts between the right to use and the right to publish, the node where the user ""pays fees"" should be regarded as the investor's transfer of the ownership of the work in a ""silent"" way. If the investment company refuses, it shall do so in an express manner.",,Journal of Intelligence and Knowledge Engineering,10.62517/jike.202304203,CrossRef,,0,https://doi.org/10.62517/jike.202304203
CR_10.1002/eng2.70114,"Artificial Intelligence and Architectural Design Before Generative
                    <scp>AI</scp>
                    : Artificial Intelligence Algorithmics Approaches 2000–2022 in Review",Ana Cocho‐Bermejo,2025,"ABSTRACT 
                   This study explores the evolution of Artificial Intelligence (AI) applications in the AEC from 2000 to 2022, focusing on the transition leading up to the accessibility of Generative AI in 2023. Through a Bibliometric review of publications indexed in Scopus, Web of Science, and CumInCAD, the research examines the adoption of specific algorithmic approaches: Genetic Algorithms (GAs), Artificial Neural Networks (ANNs), and Agent‐Based Systems(ABS). Findings reveal that GAs and ANNs exhibited comparable use until 2015, after which ANNs experienced exponential growth, surpassing GAs by 2016. ABS, although less prominent overall, saw a temporary surge starting in 2008, which established ABS as a distinct research category. Comparative analysis with CumInCAD highlights its early role as a primary repository for specialized research, surpassing WoS and Scopus untill quite a few years afterward. This research underscores key historical milestones marking AI's integration into the AEC, including advancements in evolutionary computation, machine learning, and distributed AI systems. While revealing critical trends, the study acknowledges its limitations, such as database bias and the exclusion of developments post‐2023. Future research should extend beyond this period, incorporate qualitative analysis, and explore emerging tools in generative design to understand AI's growing impact.",,Engineering Reports,10.1002/eng2.70114,CrossRef,"School of Engineering &amp; the Built Environment, Faculty of Science &amp; Engineering Anglia Ruskin University  Chelmsford UK",8,https://doi.org/10.1002/eng2.70114
CR_10.58496/bjai/2025/005,Improving Diagnostic Accuracy of Brain Tumor MRI Classification Using Generative AI and Deep Learning Techniques,Chem Sokea; Soun Marina,2025,"Brain Tumors are one of the most aggressive and deadly medical diseases with living individuals requiring a quick and highly sensitive diagnostic approaches to improve patient outcomes. Classification of brain tumors from magnetic resonance imaging (MRI) is still a difficult problem for medical imaging because the problem is highly complex, varies and the differences between the tumor types are subtle. Diagnostic accuracy and consistency are recently improved through the advances in Generative Artificial Intelligence (AI) and Deep Learning (DL) techniques. However, this paper presents a robust and efficient model based on the combination of the Generative AI approaches i.e. Generative Adversarial Networks (GANs) and Convolutional Neural Networks (CNNs) for the multi-classification of brain tumors from MRI images. With medical image dataset being limited, the GAN model is trained to augment the dataset which solves the problem of limited dataset and also that of the class imbalance. It trains and evaluates the CNN architecture on both original and artificially augmented datasets and shows that increased accuracy and generalization. The experimental results demonstrate that proposed combined approach significantly performs better than the traditional methods, thus allowing radiologists to reach higher precision, sensitivity and specificity in tumor identification and classification. The proposed methodology is a significant improvement in speeding, reliability, and precision in clinical diagnostics for Brain Tumors.",,Babylonian Journal of Artificial Intelligence,10.58496/bjai/2025/005,CrossRef,,11,https://doi.org/10.58496/bjai/2025/005
CR_10.61796/jaide.v2i11.1573,THE ROLE OF GENERATIVE ARTIFICIAL INTELLIGENCE TECHNIQUES IN PREDICTING FINANCIAL VOLATILITY: AN APPLIED STUDY ON EMERGING MARKETS,Bidaa Mohammed Ahmed,2025,"Objective: This paper examines the perception and implementation of generative artificial intelligence (AI) in the context of financial forecasting on emerging markets. Method: The research uses a structured survey that was emailed to 137 financial analysts and professionals to examine their familiarity with the latest AI technologies, their application in the field, and the obstacles that they encounter in the implementation of these models. Results: The findings show that an enormous proportion of the population feels that generative models, including GANs, can provide more valid predictions than conventional ones. Approximately 65 percent of the respondents affirm that these models render it significantly more correct to predict, and an additional 75 percent of those who responded affirm the necessity to utilize these models in order to execute contemporary financial analysis. A lack of data (68%), poor infrastructure (50%), and a lack of skills (45%) are also pointed out as some of the key issues in the study. The positive relationship between the talents of the respondents at eminent AI and their desires to employ sophisticated modelling techniques is statistically significant. The results emphasize the necessity of the construction of a strong data collection infrastructure and enhancement of technological infrastructure, and the development of human capabilities through the specialization of training. Novelty: This research provides important lessons on the opportunities and challenges of introducing generative AI models into the financial decision-making processes in emerging economies and some key areas for policy and industry intervention to optimise their potential advantages.",,Journal of Artificial Intelligence and Digital Economy,10.61796/jaide.v2i11.1573,CrossRef,,0,https://doi.org/10.61796/jaide.v2i11.1573
CR_10.14201/adcaij.31704,Generative Artificial Intelligence: Fundamentals,Juan M. Corchado; Sebastian López F.; Juan M. Núñez V.; Raul Garcia S.; Pablo Chamoso,2023,"Generative language models have witnessed substantial traction, notably with the introduction of refined models aimed at more coherent user-AI interactions—principally conversational models. The epitome of this public attention has arguably been the refinement of the GPT-3 model into ChatGPT and its subsequent integration with auxiliary capabilities such as search features in Microsoft Bing. Despite voluminous prior research devoted to its developmental trajectory, the model’s performance, and applicability to a myriad of quotidian tasks remained nebulous and task specific. In terms of technological implementation, the advent of models such as LLMv2 and ChatGPT-4 has elevated the discourse beyond mere textual coherence to nuanced contextual understanding and real-world task completion. Concurrently, emerging architectures that focus on interpreting latent spaces have offered more granular control over text generation, thereby amplifying the model’s applicability across various verticals. Within the purview of cyber defense, especially in the Swiss operational ecosystem, these models pose both unprecedented opportunities and challenges. Their capabilities in data analytics, intrusion detection, and even misinformation combatting is laudable; yet the ethical and security implications concerning data privacy, surveillance, and potential misuse warrant judicious scrutiny.",,ADCAIJ: Advances in Distributed Computing and Artificial Intelligence Journal,10.14201/adcaij.31704,CrossRef,,29,https://doi.org/10.14201/adcaij.31704
CR_10.3390/foundations5030023,Mathematical Formalism and Physical Models for Generative Artificial Intelligence,Zeqian Chen,2025,"This paper presents a mathematical formalism for generative artificial intelligence (GAI). Our starting point is an observation that a “histories” approach to physical systems agrees with the compositional nature of deep neural networks. Mathematically, we define a GAI system as a family of sequential joint probabilities associated with input texts and temporal sequences of tokens (as physical event histories). From a physical perspective on modern chips, we then construct physical models realizing GAI systems as open quantum systems. Finally, as an illustration, we construct physical models realizing large language models based on a transformer architecture as open quantum systems in the Fock space over the Hilbert space of tokens. Our physical models underlie the transformer architecture for large language models.",,Foundations,10.3390/foundations5030023,CrossRef,"Wuhan Institute of Physics and Mathematics, IAPM, Chinese Academy of Sciences, 30 West District, Xiao-Hong-Shan, Wuhan 430071, China",0,https://doi.org/10.3390/foundations5030023
CR_10.70008/nhj.v1i02.13,MIS and the Rise of Artificial Intelligence: A Symbiotic Relationship,; chatgpt .openai.com; Najmus Saqib; ,2024,"The integration of Artificial Intelligence (AI) with Management Information Systems (MIS) marks a revolutionary transformation in the landscape of business operations and decision-making processes. This research article explores the symbiotic relationship between MIS and AI, examining how AI enhances MIS capabilities, the mutual benefits derived from their convergence, and the implications for future business practices. The analysis delves into key areas such as data analytics, decision support systems, and operational efficiency, providing a comprehensive under-standing of the synergistic potential of MIS and AI.",,Non human journal,10.70008/nhj.v1i02.13,CrossRef,,0,https://doi.org/10.70008/nhj.v1i02.13
CR_10.9781/ijimai.2024.02.011,Generative Artificial Intelligence in Education: From Deceptive to Disruptive.,Marc Alier; Francisco José García Peñalvo; Jorge D. Camba,2024,"Generative Artificial Intelligence (GenAI) has emerged as a promising technology that can create original content, such as text, images, and sound. The use of GenAI in educational settings is becoming increasingly popular and offers a range of opportunities and challenges. This special issue explores the management and integration of GenAI in educational settings, including the ethical considerations, best practices, and opportunities. The potential of GenAI in education is vast. By using algorithms and data, GenAI can create original content that can be used to augment traditional teaching methods, creating a more interactive and personalized learning experience. In addition, GenAI can be utilized as an assessment tool and for providing feedback to students using generated content. For instance, it can be used to create custom quizzes, generate essay prompts, or even grade essays. The use of GenAI as an assessment tool can reduce the workload of teachers and help students receive prompt feedback on their work. Incorporating GenAI in educational settings also poses challenges related to academic integrity. With availability of GenAI models, students can use them to study or complete their homework assignments, which can raise concerns about the authenticity and authorship of the delivered work. Therefore, it is important to ensure that academic standards are maintained, and the originality of the student's work is preserved. This issue highlights the need for implementing ethical practices in the use of GenAI models and ensuring that the technology is used to support and not replace the student's learning experience.",,International Journal of Interactive Multimedia and Artificial Intelligence,10.9781/ijimai.2024.02.011,CrossRef,,89,https://doi.org/10.9781/ijimai.2024.02.011
CR_10.1093/elt/ccae032,Generative artificial intelligence and ELT,Benjamin Luke Moorhouse,2024,"Abstract 
                In this series, we explore technology-related themes and topics. The series aims to discuss and demystify what may be new areas for some readers and to consider their relevance for English language teachers.",,ELT Journal,10.1093/elt/ccae032,CrossRef,,31,https://doi.org/10.1093/elt/ccae032
CR_10.47191/ijmei/v12i3.01,"Role of Generative Artificial Intelligence (ChatGPT) in Human Resource Development: Opportunities, Challenges, and Strategic Implications",Ruchi Verma; Anjali Kumari Thakur; Abhijeet Kumar; Salima Barwa,2026,"The rapid development of generative artificial intelligence, especially ChatGPT, is bringing noticeable changes to Human Resource Development (HRD) practices. Organizations are increasingly using AI-based tools to improve training programs, employee learning, and performance support systems. This study examines how ChatGPT can assist HR professionals in creating learning content, supporting personalized skill development, and enhancing employee engagement. The research is conceptual in nature and is based on a review of existing academic and industry literature. The findings suggest that ChatGPT improves access to learning resources and reduces the administrative burden of HR teams. However, concerns related to information accuracy, ethical use, data privacy, and over-dependence on technology must be carefully managed. The study highlights the importance of combining AI capabilities with human supervision to ensure responsible and effective implementation. Overall, ChatGPT can strengthen HRD practices when used as a supportive tool rather than a replacement for human expertise.",,International Journal of Management and Economics Invention,10.47191/ijmei/v12i3.01,CrossRef,"Lovely Professional University, India",0,https://doi.org/10.47191/ijmei/v12i3.01
