id,title,authors,year,abstract,keywords,journal,doi,source_db,country,citations,url
CR_10.71420/ijref.v2i11.210,Empirical investigation of generative artificial intelligence acceptability determinants among Moroccan chartered accountants: A structural equation modeling approach,Adellatif Aziki,2025,"This study examines generative artificial intelligence (GAI) acceptability determinants among Moroccan chartered accountants using the Unified Theory of Acceptance and Use of Technology (UTAUT). Data collection from 262 professionals (31.9% response rate) applied a quantitative methodology based on the UTAUT framework. Partial least squares structural equation modeling assessed relationships between four determinants and GAI acceptability. Results indicate effort expectancy (β=0.538, f²=0.213) and social influence (β=0.498, f²=0.109) as primary determinants, while performance expectancy (β=0.319, f²=0.004) shows limited effect size despite statistical significance. Facilitating conditions demonstrate no substantial contribution (f²=0.000). The model explains 40.4% of GAI acceptability variance. These findings reveal distinct adoption patterns where ease of use and social factors predominate over performance considerations in the Moroccan accounting profession, contributing empirical evidence from non-Western professional contexts to technology acceptance literature.",,International Journal of Research in Economics and Finance,10.71420/ijref.v2i11.210,CrossRef,,0,https://doi.org/10.71420/ijref.v2i11.210
CR_10.47263/jrtm.04-02-06,Generative Artificial Intelligence and Responsible Tourism,,2024,"Generative Artificial Intelligence (AI) tools such as ChatGPT have taken the world by storm with their ease of adoption and perceived usefulness in performing expedited searches and sourcing for required information online. Such tools have also entered the tourism landscape, with consumers, businesses, and destinations seeking to tap into their immense potential and create personalized resources for their intended audiences. However, the rapid evolution of generative AI has almost ignored the ethical, moral, and responsible uses of these technologies. This research note is a timely commentary and introspection of the state of play and calls for greater reflexivity and responsibility to ensure that the tools are not abused to the detriment of tourism stakeholders.",,Journal of Responsible Tourism Management,10.47263/jrtm.04-02-06,CrossRef,,0,https://doi.org/10.47263/jrtm.04-02-06
CR_10.58496/bjai/2024/015,Generative Models in Natural Language Processing: A Comparative Study of ChatGPT and Gemini,Abdulazeez Alsajri; Hasan Ahmed Salman; Amani Steiti,2024,"Generative models in natural language processing (NLP) have transformed machine interactions with human language. This research offers a comparative examination of ChatGPT and Gemini, two cutting-edge NLP models. This research elucidates the distinct strengths and shortcomings of each model by analyzing conversational fluency, diversity, and contextual accuracy. ChatGPT has exceptional originality in word production, but Gemini excels in contextual variety and sophisticated learning methodologies. The results highlight the revolutionary capability of generative models in fields such as education, customer service, and content production. Anticipated future improvements in this field are projected to enhance these capabilities, promoting wider societal and industrial advantages.",,Babylonian Journal of Artificial Intelligence,10.58496/bjai/2024/015,CrossRef,,13,https://doi.org/10.58496/bjai/2024/015
CR_10.3389/frai.2025.1654716,Artificial Creativity: from predictive AI to Generative System 3,Juan Carlos Chávez-Autor,2025,"Large language models generate fluent text yet often fail to sustain novelty, task relevance, and diversity across extended contexts. We argue this shortfall persists because current systems implement only fragments of a tri-process loop that supports human creativity: spontaneous ideation in the default-mode network (DMN; broadly  System 1 –like), goal-directed evaluation in the central-executive network (CEN; broadly  System 2 –like), and a metacognitive integrator— System 3 —that, via neuromodulatory gain control, shifts between exploration and focused control. We introduce  Generative System 3  (GS-3), an architecture-agnostic design pattern with three roles: a high-entropy  generator , a learned  critic , and an adaptive  gain controller . Beyond “pure prediction” and simple “reflective prompting,” GS-3 identifies the missing pieces for  Artificial Creativity : an internal evaluator, endogenous control over sampling entropy, and adaptive priors maintained across extended contexts. This conceptual analysis (i) formalizes  novelty ,  usefulness , and  diversity  with operational definitions; (ii) develops multiple gain-update policies (exponential, linear, logistic) with stability constraints and sensitivity expectations; (iii) derives falsifiable behavioral indices— associative-distance density ,  analytic-verification ratio , and  convergence latency —with pass–fail criteria; and (iv) provides a proof-of-concept blueprint and evaluation protocol (tasks, metrics, ablations, reproducibility kit). We position GS-3 relative to computational-creativity and co-creative frameworks, and delineate where brain–model analogies are functional rather than literal. Ethical guidance addresses bias, cultural homogenization, and reward gaming of proxy objectives (often termed “dopamine hacking”) through plural critics, transparent logging, and outcome-tied entropy caps. The result is a testable roadmap for transitioning from regulated prediction to genuinely creative generative systems.",,Frontiers in Artificial Intelligence,10.3389/frai.2025.1654716,CrossRef,,1,https://doi.org/10.3389/frai.2025.1654716
CR_10.24002/jarina.v3i1.8347,Generative Artificial Intelligence to Enhance Architecture Education to Develop Digital Literacy and Holistic Competency,Tris Kee; Blair Kuys; Ronnel King,2024,"This research investigates the impact of Generative Artificial Intelligence (GenAI) on digital literacy development and holistic competencies in Architecture education. The research design focuses on applying GenAI tools such as ChatGPT, Midjourney, BricsCAD BIM, and VR/AR software and their influence on architectural students' overall competencies. This paper uses a mixed research approach combining a case study of Architecture students' progress in a residential revisitation project, using Midjourney, BricsCAD BIM, and VR/AR software, with an online questionnaire survey administered to 350 undergraduate students at two leading universities in Mainland China and Hong Kong in the 2023-2024 school year. This approach aims to deepen understanding of GenAI's influence on conceptual creativity, initiative, self-management, and stress tolerance within a holistic competency framework. The research results indicate that architecture students frequently use GenAI tools during the design concept stage, suggesting their relevance to specific pedagogy in-studio learning and conceptual creativity. Additionally, the findings reveal a potential correlation between frequent GenAI tool usage, improved time management, and reduced anxiety among Architecture students. The results enhance understanding of digital technology in Architecture education while providing valuable insights for future GenAI implementations. The study highlights the potential benefits of incorporating GenAI, emphasizing their role in fostering creativity, effective time management, and stress tolerance among Architecture students.",,Journal of Artificial Intelligence in Architecture,10.24002/jarina.v3i1.8347,CrossRef,,17,https://doi.org/10.24002/jarina.v3i1.8347
CR_10.21825/ewopinpractice.94697,Promise or peril? Sentiments shaping the adoption of Generative Artificial Intelligence in Human Resource Management,Marna van der Merwe; Dieter Veldsman,2025,"This study examines the perceptions and sentiments of Human Resource (HR) Management professionals regarding the adoption and application of Generative AI (GenAI) technologies. Findings reveal that individual and organizational factors significantly influence HR professionals’ attitudes toward GenAI and their behaviours when utilizing these tools. Exposure to GenAI tools fosters an appreciation for their potential, particularly in automating routine tasks and enabling a shift toward more human-centric, value-added activities such as employee engagement, strategic talent management, and personalized employee experiences. However, skills deficits and organizational barriers, including data security and ethical use concerns, remain significant challenges to sustained adoption. While exposure to GenAI tools builds confidence, a lack of organizational support and opportunities to practice using these tools limits their integration into daily HR practices. The study highlights the critical need for robust governance frameworks, clear guidelines, and hands-on opportunities to build technical competence and confidence in AI utilization. Addressing these systemic issues is essential for enabling HR professionals to fully leverage the transformative potential of GenAI and contribute to more impactful and human-centred HR practices.",,EWOP in Practice,10.21825/ewopinpractice.94697,CrossRef,Academy to Innovate HR,0,https://doi.org/10.21825/ewopinpractice.94697
CR_10.55529/jaimlnn.52.13.23,Responsible integration of generative artificial intelligence in academic writing: a narrative review and synthesis,Umar Sodangi; Akilu Isma’il,2025,"The ethical integration, risks, and institutional reactions related to the use of generative Artificial Intelligence (AI) in academic writing are examined in this narrative review and conceptual synthesis. Concerns regarding authorship ethics, academic integrity, and cognitive development have surfaced as a result of the quick adoption of AI tools like ChatGPT in higher education. This review identified three main themes regarding the responsible integration of generative AI in academic writing: 1. Significant risks such as plagiarism, fake or hallucinated citations, and data fabrication; 2. ethical integration of AI that emphasizes transparency, human oversight, and meaningful contribution; and 3. expanding institutional frameworks and policies intended to ensure responsible AI use. The review revealed clear risks of plagiarism, hallucinated content, citation errors, and authorship problems, hence the need for transparency, responsible use, and clear disclosure to uphold academic integrity in AI-assisted writing. It also revealed promising advancements in institutional responses; however, significant challenges remain in policy and compliance, faculty training, and ethical oversight particularly regarding the role of AI in research evaluation and publication processes. Among others, it is recommended that institutions should adopt a balanced stance to AI in academic writing by encouraging transparency and providing training on potential risks such as misuse or misinformation.",,"Journal of Artificial Intelligence, Machine Learning and Neural Network",10.55529/jaimlnn.52.13.23,CrossRef,"Department of Science Education, Faculty of Education, Federal University, Gusau, Nigeria.",1,https://doi.org/10.55529/jaimlnn.52.13.23
CR_10.6087/kcse.352,Ethical guidelines for the use of generative artificial intelligence and artificial intelligence-assisted tools in scholarly publishing: a thematic analysis,Adéle da Veiga,2025,"Purpose: This analysis aims to propose guidelines for artificial intelligence (AI) research ethics in scientific publications, intending to inform publishers and academic institutional policies in order to guide them toward a coherent and consistent approach to AI research ethics.Methods: A literature-based thematic analysis was conducted. The study reviewed the publication policies of the top 10 journal publishers addressing the use of AI in scholarly publications as of October 2024. Thematic analysis using Atlas.ti identified themes and subthemes across the documents, which were consolidated into proposed research ethics guidelines for using generative AI and AI-assisted tools in scholarly publications.Results: The analysis revealed inconsistencies among publishers’ policies on AI use in research and publications. AI-assisted tools for grammar and formatting are generally accepted, but positions vary regarding generative AI tools used in pre-writing and research methods. Key themes identified include author accountability, human oversight, recognized and unrecognized uses of AI tools, and the necessity for transparency in disclosing AI usage. All publishers agree that AI tools cannot be listed as authors. Concerns involve biases, quality and reliability issues, compliance with intellectual property rights, and limitations of AI detection tools.Conclusion: The article highlights the significant knowledge gap and inconsistencies in guidelines for AI use in scientific research. There is an urgent need for unified ethical standards, and guidelines are proposed for distinguishing between the accepted use of AI-assisted tools and the cautious use of generative AI tools.",,Science Editing,10.6087/kcse.352,CrossRef,,8,https://doi.org/10.6087/kcse.352
CR_10.47191/rajar/v11i10.12,Transforming Communication Through Virtual Assistants using Generative Artificial Intelligence,; María del Carmen Islas López; Oscar Lira Uribe; ; Irma Cárdenas García; ,2025,"Gratitude is a positive emotion reflecting an appreciation and acknowledgment of the good things an individual receives from others and from life. Prosocial behavior reflects the tendency to help, share, and contribute to the common good. Meaning in life is an individual's sense of purpose and the perceived value of their own existence. This study aims to investigate the relationship between gratitude and prosocial behavior among high school students in Da Nang city, and to simultaneously examine the mediating role of meaning in life in this relationship.

The study was conducted with 407 participating students who completed a survey using three standardized scales measuring gratitude, prosocial behavior, and meaning in life. The analysis results indicate that gratitude has a positive and significant influence on prosocial behavior, and that meaning in life partially mediates this relationship. This suggests that when students experience higher levels of gratitude, they tend to perceive their lives as more meaningful, and consequently exhibit more prosocial behaviors.

Based on these findings, the study proposes several educational measures and experiential activities aimed at fostering gratitude and enhancing the perception of meaning in life for high school students, thereby contributing to the formation of positive character and a spirit of social responsibility in the younger generation.",,RA JOURNAL OF APPLIED RESEARCH,10.47191/rajar/v11i10.12,CrossRef,,0,https://doi.org/10.47191/rajar/v11i10.12
CR_10.62517/jike.202304110,On the Identification of the Work Nature of Generative Artificial Intelligence Creation,Jiacheng Jiang,2023,"In the new scientific and technological revolution caused by the cognitive paradigm of law and the development of disciplinary update is on the rise, the ""generative artificial intelligence"" chat machine represented by ChatGPT, Wenxin Yiyi, etc., came into being. Based on the characteristics of ""generative artificial intelligence"", it is very likely to trigger new thinking about the right attribute and attribution of ""Works of art"" in the field of copyright."" Generative AI"" chat machine is a natural language processing tool developed based on deep neural network architecture, which is essentially a neural network machine learning language model. This paper analyzes the development of copyright law by literature analysis and historical analysis, and the origin of the concept of ""work"".Under the idea of distinction, the identification of works should be discussed separately from the ownership of rights. According to the standards of the Copyright Law for the identification of works, when the content generated by ""generative artificial intelligence"" meets the basic requirements of ""thought - expression + originality + intellectual achievement"" and meets the field limitation of ""literature, art and science"", it should be included in the scope of work protection.",,Journal of Intelligence and Knowledge Engineering,10.62517/jike.202304110,CrossRef,,0,https://doi.org/10.62517/jike.202304110
CR_10.14738/tmlai.1302.18401,Crimebots and Lawbots: Cyberwarfare Powered by Generative Artificial Intelligence,; Peter E. Murray,2025,"Crimebots are fueling the cybercrime pandemic by exploiting artificial intelligence (AI) to facilitate crimes such as fraud, misrepresentation, extortion, blackmail, identity theft, and security breaches. These AI-driven criminal activities pose a significant threat to individuals, businesses, online transactions, and even the integrity of the legal system. Crimebots enable unjust exonerations and wrongful convictions by fabricating evidence, creating deepfake alibis, and generating misleading crime reconstructions. In response, lawbots have emerged as a counterforce, designed to uphold justice. Legal professionals use lawbots to collect and analyze evidence, streamline legal processes, and enhance the administration of justice. To mitigate the risks posed by both crimebots and lawbots, many jurisdictions have established ethical guidelines promoting the responsible use of AI by lawyers and clients. Approximately 1.34% of lawyers have been involved in AI-related legal disputes, often revolving around issues such as fees, conflicts of interest, negligence, ethical violations, evidence tampering, and discrimination. Additional concerns include fraud, confidentiality breaches, harassment, and the misuse of AI for criminal purposes. For lawbots to succeed in the ongoing battle against crimebots, strict adherence to complex AI regulations is essential. Ensuring compliance with these guidelines minimizes malpractice risks, prevents professional sanctions, preserves client trust, and upholds the ethical and legal professional standards of excellence.",,Transactions on Machine Learning and Artificial Intelligence,10.14738/tmlai.1302.18401,CrossRef,,0,https://doi.org/10.14738/tmlai.1302.18401
CR_10.58496/mjaih/2024/019,Generative Artificial Intelligence and Cybersecurity Risks: Implications for Healthcare Security Based on Real-life Incidents,Malik Sallam; Kholoud Al-Mahzoum; Mohammed Sallam,2024,"Background: The potential of generative artificial intelligence (genAI) tools, such as ChatGPT, is being increasingly explored in healthcare settings. However, the same tools also introduce significant cybersecurity risks that could compromise patient safety, data integrity, and institutional trust. This study aimed to examine real-world security breaches involving genAI and extrapolate their potential implications for healthcare settings.
Methods: Using a systematic Google News search and a consensus-based approach among the authors, five high-profile genAI breaches were identified and analyzed. These cases included: (1) Data exposure in ChatGPT (OpenAI) due to an open-source library bug (March 2023); (2) Unauthorized data disclosure via Samsung’s (Samsung Group) use of ChatGPT (2023); (3) Logical vulnerabilities in Chevrolet (General Motors) AI-powered chatbot resulting in pricing errors (December 2023); (4) Prompt injection vulnerability in Vanna AI (Vanna AI, Inc.) which enabled remote code execution (2024); and (5) the deepfake technology used in a scam targeting the engineering firm Arup (Arup Group Limited), leading to fraudulent transactions (February 2024). Hypothetical healthcare scenarios were constructed based on the five cases, mapping their mechanisms to vulnerabilities in electronic health records (EHRs), clinical decision support systems (CDSS), and patient engagement platforms. Each case was analyzed using the Confidentiality, Integrity, and Availability (CIA) triad of information security to systematically identify vulnerabilities and propose actionable safeguards.
Results: The analyzed cases of AI security breaches revealed significant risks to healthcare systems. Confidentiality violations included the potential exposure of sensitive patient records and billing information, extrapolated from incidents such as the ChatGPT data exposure and Samsung’s cases. These identified security breaches raised concerns about privacy violations, identity theft, and non-compliance with regulations such as Health Insurance Portability and Accountability Act (HIPAA). Integrity vulnerabilities were highlighted in Vanna AI's prompt injection flaw incident, with risks of altering patient records, compromising diagnostic algorithms, and misleading CDSS with erroneous recommendations. Similarly, logic errors identified in the Chevrolet case exposed potential risks of inaccurate billing, double-booked appointments, and flawed treatment plans within healthcare contexts. Availability disruptions, observed through system outages and operational suspensions following breaches like the ChatGPT and deepfake cases, can delay access to EHR systems or AI-driven CDSS. Such interruptions would directly impact patient care and create inefficiencies in administrative workflows.
Conclusions: Generative AI presents a double-edged sword in healthcare, with transformative potential accompanied by substantial risks. Extrapolation of security breach cases in this study highlighted the urgent need for robust safeguards if genAI is implemented in healthcare settings. To address these vulnerabilities, healthcare institutions must implement strong security protocols, enforce strict data governance, and create AI-specific incident response plans. The balance between genAI-enabled innovation and protection of patient safety and data integrity trust requires proactive safety measures.",,Mesopotamian Journal of Artificial Intelligence in Healthcare,10.58496/mjaih/2024/019,CrossRef,,9,https://doi.org/10.58496/mjaih/2024/019
CR_10.1055/a-2780-0664,Generative artificial intelligence for patient education material on gastric cancer prevention,Tommy Rizkala; Natasha Muench; Cesare Hassan; Mario Dinis-Ribeiro; ,2026,"Background This study assessed the effectiveness of large language models (LLMs) in generating lay summaries for patient education on the management of precancerous lesions and early neoplasia in the stomach. 
                   Methods In this pilot study, we used a two-period, crossover, blinded design to compare a ChatGPT-4o summary versus a Digestive Cancers Europe (DiCE) summary. Two panels rated the materials: expert physicians and DiCE Patient Advisory Committee members. Experts scored accuracy, completeness, comprehensibility, and satisfaction (across five sections); patients rated overall completeness, comprehensibility, and satisfaction. Paired comparisons used mixed-effects estimates. Readability was assessed with Flesch–Kincaid grade level (FKGL) and SMOG index. 
                   Results Median expert ratings were similar between materials across metrics. For the overall summary, median (range; IQR) scores were: accuracy 5 (4–6; 1) for ChatGPT-4o vs. 5 (3–6; 1) for DiCE (P = 0.10); completeness 4 (3–5; 1) vs. 4 (2–5; 1; P = 0.27); comprehensibility 4 (3–5; 1) vs. 4 (2–5; 1; P = 0.33); and satisfaction 4 (2–5; 1) vs. 3 (1–5; 2; P = 0.53). Patient ratings mirrored experts, with very similar results. Readability failed to meet guideline recommendations for both summaries on both FKGL and SMOG scores. 
                   Conclusion ChatGPT-4o produced patient materials comparable to DiCE, but both require readability optimization; a human-in-the-loop workflow and future tests across prompts and models are warranted.",,Endoscopy,10.1055/a-2780-0664,CrossRef,"Department of Gastroenterology, IRCCS Humanitas Research Hospital, Rozzano, Italy",0,https://doi.org/10.1055/a-2780-0664
CR_10.71068/xhrekk23,Adaptaciones Pedagógicas en Recursos Didácticos Creados con Inteligencia Artificial Generativa: Desafíos y Alternativas para la Docencia,Silvia Saborío Taylor; Alejandra Álvarez Chaves,2025,"Generative Artificial Intelligence (GAI) is transforming education by facilitating the creation of innovative and adaptable teaching resources. However, its effective use requires critical thinking and specific pedagogical adaptations to ensure alignment with educational objectives. This qualitative study, conducted with student teachers at the National University of Costa Rica, analyzed how generated resources are adjusted in terms of content, language, and graphic design. The results showed that, although GAI optimizes tasks, initial outputs often require significant modifications to enhance educational relevance. Discussion forums highlighted the tool's usefulness while emphasizing the need for teacher supervision to personalize materials. A case study demonstrated improvements after critical revisions, underscoring the importance of critical thinking in validating and adapting resources. These findings suggest that GAI does not replace teaching roles but complements them when applied ethically and reflectively. Ongoing teacher training and further research are recommended to assess its impact on student learning.",,Sapiens in Artificial Intelligence,10.71068/xhrekk23,CrossRef,,0,https://doi.org/10.71068/xhrekk23
