id,title,authors,year,abstract,keywords,journal,doi,source_db,country,citations,url
EBSCO_7812528463685324177,Research of Project-Based Teaching in Engineering Courses Driven by Gen-AI: Taking Electromagnetic Field Course as Example,"Zhong, Hui; Wang, Xiaolong; Wei, Haotian; Computing and Processing; Technological innovation; Generative AI; Human-machine systems",2025,"Publicaciones arbitradas
Ponencia de conferencia
Herramientas para Research of Project-Based Teaching in Engineering Courses Driven by Gen-AI: Taking Electromagnetic Field Course as Example
Research of Project-Based Teaching in Engineering Courses Driven by Gen-AI: Taking Electromagnetic Field Course as Example",Computing and Processing; Technological innovation; Generative AI; Human-machine systems,"2025 International Conference on Educational Technology Management (ICETM), Educational Technology Management (ICETM), 2025 International Conference on, 2025",,EBSCO,,0,
EBSCO_919620519421826081,GenAI: Our Tool Or Our Future Master?,Engineering Profession; General Topics for Engineers; Artificial intelligence; Humanities,2026,"Publicaciones arbitradas
Publicación académica
Herramientas para GenAI: Our Tool Or Our Future Master?
GenAI: Our Tool Or Our Future Master?",Engineering Profession; General Topics for Engineers; Artificial intelligence; Humanities,"IEEE Transactions on Technology and Society, Technology and Society, IEEE Transactions on, IEEE Trans",,EBSCO,,0,
EBSCO_2787562051813317383,RO-SVD+: A Hardware-Based Framework Against AI Attacks for Cost-Effective GenAI Copyright Protection in Consumer Electronics,"Power, Energy and Industry Applications; Components, Circuits, Devices and Systems; Fields, Waves and Electromagnetics; Artificial intelligence",2026,"Publicaciones arbitradas
Publicación académica
Herramientas para RO-SVD+: A Hardware-Based Framework Against AI Attacks for Cost-Effective GenAI Copyright Protection in Consumer Electronics
RO-SVD+: A Hardware-Based Framework Against AI Attacks for Cost-Effective GenAI Copyright Protection in Consumer Electronics","Power, Energy and Industry Applications; Components, Circuits, Devices and Systems; Fields, Waves and Electromagnetics; Artificial intelligence","IEEE Transactions on Consumer Electronics, Consumer Electronics, IEEE Transactions on, IEEE Trans",,EBSCO,,0,
EBSCO_-7771235450512410412,Retrieval-Augmented Generation for GenAI-Enabled Semantic Communications,"Communication, Networking and Broadcast Technologies; Computing and Processing; Signal Processing and Analysis; Receivers",2026,"Publicaciones arbitradas
Publicación académica
Herramientas para Retrieval-Augmented Generation for GenAI-Enabled Semantic Communications
Retrieval-Augmented Generation for GenAI-Enabled Semantic Communications","Communication, Networking and Broadcast Technologies; Computing and Processing; Signal Processing and Analysis; Receivers","IEEE Wireless Communications, Wireless Communications, IEEE, IEEE Wireless Commun.,",,EBSCO,,0,
EBSCO_2210711910845630420,全球税收冲击下中国短期跨境资本流动的 结构跃迁与政策响应机制 ———基于生成式人工智能语义指数的嵌入分析.,郭皓晨; 周慧蕙; 高 伦; Generative artificial intelligence; Foreign investments; International finance; Macroeconomics,2026,"Publicaciones arbitradas
Publicación académica
Herramientas para 全球税收冲击下中国短期跨境资本流动的 结构跃迁与政策响应机制 ———基于生成式人工智能语义指数的嵌入分析.
全球税收冲击下中国短期跨境资本流动的 结构跃迁与政策响应机制 ———基于生成式人工智能语义指数的嵌入分析.",Generative artificial intelligence; Foreign investments; International finance; Macroeconomics,"Journal of Technology Economics,",,EBSCO,,0,
EBSCO_-3178035769419615550,A Systematic Literature Review on the Pedagogical Implications and Impact of GenAI on Students' Critical Thinking.,"Díaz, Brayan; Generative artificial intelligence; Critical thinking; Educational technology; Psychological factors",2023,"Publicaciones arbitradas
Publicación académica
Herramientas para A Systematic Literature Review on the Pedagogical Implications and Impact of GenAI on Students' Critical Thinking.
A Systematic Literature Review on the Pedagogical Implications and Impact of GenAI on Students' Critical Thinking.",Generative artificial intelligence; Critical thinking; Educational technology; Psychological factors,"Algorithms, Mar",,EBSCO,,0,
EBSCO_8760430560001562975,"Planificación microcurricular intercultural con inteligencia artificial generativa: evidencias, desafíos y aportes en el modelo educativo.","Albán Cuestas, Julissa Josefina; Andrade Namicela, Rosa Inés; Bravo Quezada, Omar Gustavo; Generative artificial intelligence; Curriculum planning; Education ethics; Teacher training",,"Publicaciones arbitradas
Publicación académica
Herramientas para Planificación microcurricular intercultural con inteligencia artificial generativa: evidencias, desafíos y aportes en el modelo educativo.
Planificación microcurricular intercultural con inteligencia artificial generativa: evidencias, desafíos y aportes en el modelo educativo.",Generative artificial intelligence; Curriculum planning; Education ethics; Teacher training,"Sinergia Académica, feb",,EBSCO,,0,
EBSCO_4907299201596666913,"Teaching Challenges, Ethical Considerations, and Equity Issues: Navigating Gen AI Use in Northeastern University's EdD Program",Joseph McNabb; Kelly Conn; Joan Giblin; Artificial Intelligence; Teaching Methods; Barriers; Ethics,2026,"Publicaciones arbitradas
Publicación académica
Herramientas para Teaching Challenges, Ethical Considerations, and Equity Issues: Navigating Gen AI Use in Northeastern University's EdD Program
Teaching Challenges, Ethical Considerations, and Equity Issues: Navigating Gen AI Use in Northeastern University's EdD Program",Artificial Intelligence; Teaching Methods; Barriers; Ethics,"Impacting Education: Journal on Transforming Professional Practice,",,EBSCO,,0,
EBSCO_-684964236635064148,Awareness of Generative Artificial Intelligence in Chemistry Education among Trainee Teachers,Thivya Sri Chandran; Yuhanis Mhd Bakri; Artificial Intelligence; Preservice Teachers; Chemistry; Science Education,2026,"Publicaciones arbitradas
Publicación académica
Herramientas para Awareness of Generative Artificial Intelligence in Chemistry Education among Trainee Teachers
Awareness of Generative Artificial Intelligence in Chemistry Education among Trainee Teachers",Artificial Intelligence; Preservice Teachers; Chemistry; Science Education,"Journal of Education and Learning (EduLearn),",,EBSCO,,0,
EBSCO_-9174406533948820525,The Impact of GenAI Chatbots on Student Learning in Higher Education: A Literature Review,Merete Badger; Nuria López; Camilla Falk Rønne Nissen; Literature Reviews; Higher Education; Artificial Intelligence; Intelligent Tutoring Systems,2026,"Publicaciones arbitradas
Publicación académica
Herramientas para The Impact of GenAI Chatbots on Student Learning in Higher Education: A Literature Review
The Impact of GenAI Chatbots on Student Learning in Higher Education: A Literature Review",Literature Reviews; Higher Education; Artificial Intelligence; Intelligent Tutoring Systems,"International Journal of Technology in Education,",,EBSCO,,0,
EBSCO_-4353094987830387967,Brain Tumour Detection System Using Deep CNN and GenAI,"P, Poovizhi; P, Rajasekaran; T, Vijaya Kumar; Aerospace; Bioengineering; Communication, Networking and Broadcast Technologies; Components, Circuits, Devices and Systems",2026,"Publicaciones arbitradas
Ponencia de conferencia
Herramientas para Brain Tumour Detection System Using Deep CNN and GenAI
Brain Tumour Detection System Using Deep CNN and GenAI","Aerospace; Bioengineering; Communication, Networking and Broadcast Technologies; Components, Circuits, Devices and Systems","2026 Sixth International Conference on Advances in Electrical, Computing, Communications and Sustainable Technologies (ICAECT), Advances in Electrical, Computing, Communications and Sustainable Technologies (ICAECT), 2026 Sixth International Conference on, 2026",,EBSCO,,0,
EBSCO_2622239384084948336,"GenAI CV: A GDPR-Compliant, AI-Driven Resume Builder for ATS Optimisation","Azhar, M A Hannan Bin; Bioengineering; Communication, Networking and Broadcast Technologies; Computing and Processing; Signal Processing and Analysis",2025,"Publicaciones arbitradas
Ponencia de conferencia
Herramientas para GenAI CV: A GDPR-Compliant, AI-Driven Resume Builder for ATS Optimisation
GenAI CV: A GDPR-Compliant, AI-Driven Resume Builder for ATS Optimisation","Bioengineering; Communication, Networking and Broadcast Technologies; Computing and Processing; Signal Processing and Analysis","2025 5th International Conference on Intelligent Cybernetics Technology & Applications (ICICyTA), Intelligent Cybernetics Technology & Applications (ICICyTA), 2025 5th International Conference on, 2025",,EBSCO,,0,
EBSCO_4331536806059619111,Understanding GenAI Adoption in Higher Education: An Integrated Model of Motivational Needs and Technology Acceptance,"Chan, Ka Ian; Chan, Ngai Seng; Pang, Patrick Cheong-Iao; Bioengineering; Computing and Processing; Engineering Profession; General Topics for Engineers",2025,"Publicaciones arbitradas
Ponencia de conferencia
Herramientas para Understanding GenAI Adoption in Higher Education: An Integrated Model of Motivational Needs and Technology Acceptance
Understanding GenAI Adoption in Higher Education: An Integrated Model of Motivational Needs and Technology Acceptance",Bioengineering; Computing and Processing; Engineering Profession; General Topics for Engineers,"2025 IEEE International Conference on Teaching, Assessment, and Learning for Engineering (TALE), Teaching, Assessment, and Learning for Engineering (TALE), 2025 IEEE International Conference on, 2025",,EBSCO,,0,
EBSCO_1947571943835875726,Evaluating the Impact of GenAI-CDIO Authentic Assessment in Embedded Systems Design Course,"Loo, Jonathan; Chen, Yue; Chai, Kok Keong; Bioengineering; Computing and Processing; Engineering Profession; General Topics for Engineers",2025,"Publicaciones arbitradas
Ponencia de conferencia
Herramientas para Evaluating the Impact of GenAI-CDIO Authentic Assessment in Embedded Systems Design Course
Evaluating the Impact of GenAI-CDIO Authentic Assessment in Embedded Systems Design Course",Bioengineering; Computing and Processing; Engineering Profession; General Topics for Engineers,"2025 IEEE International Conference on Teaching, Assessment, and Learning for Engineering (TALE), Teaching, Assessment, and Learning for Engineering (TALE), 2025 IEEE International Conference on, 2025",,EBSCO,,0,
EBSCO_5434568028838408847,"GenAI Awareness for High School Students: Case Study of Nearby Schools Around Nusantara, Indonesia","Wijanto, Maresha Caroline; Karnalim, Oscar; Margaretha, Yolla; Bioengineering; Communication, Networking and Broadcast Technologies; Components, Circuits, Devices and Systems; Computing and Processing",2025,"Publicaciones arbitradas
Ponencia de conferencia
Herramientas para GenAI Awareness for High School Students: Case Study of Nearby Schools Around Nusantara, Indonesia
GenAI Awareness for High School Students: Case Study of Nearby Schools Around Nusantara, Indonesia","Bioengineering; Communication, Networking and Broadcast Technologies; Components, Circuits, Devices and Systems; Computing and Processing","2025 13th International Conference on Orange Technology (ICOT), Orange Technology (ICOT), 2025 13th International Conference on,",,EBSCO,,0,
EBSCO_-249342482988734020,The Interaction of Generative Artificial Intelligence with Computational Intelligence on the Knowledge Economy: A Text Mining Approach,"Shetty, Lakshmi; Srivastava, Shefali; Dwivedi, Ashish; Aerospace; Communication, Networking and Broadcast Technologies; Components, Circuits, Devices and Systems; Computing and Processing",2025,"Publicaciones arbitradas
Ponencia de conferencia
Herramientas para The Interaction of Generative Artificial Intelligence with Computational Intelligence on the Knowledge Economy: A Text Mining Approach
The Interaction of Generative Artificial Intelligence with Computational Intelligence on the Knowledge Economy: A Text Mining Approach","Aerospace; Communication, Networking and Broadcast Technologies; Components, Circuits, Devices and Systems; Computing and Processing","2025 International Conference on Computational Intelligence and Knowledge Economy (ICCIKE), Computational Intelligence and Knowledge Economy (ICCIKE), 2025 International Conference on, 2025",,EBSCO,,0,
EBSCO_2860211770950643695,GenAI in Higher Education: A Review of Student Adoption and A Future Research Agenda,"Truong, Nguyen Anh Khoa; Huynh-Thanh, Tuan; Huynh, Nguyen Duc Khanh; Computing and Processing; Ethics; Technological innovation; Analytical models",2025,"Publicaciones arbitradas
Ponencia de conferencia
Herramientas para GenAI in Higher Education: A Review of Student Adoption and A Future Research Agenda
GenAI in Higher Education: A Review of Student Adoption and A Future Research Agenda",Computing and Processing; Ethics; Technological innovation; Analytical models,"2025 19th International Conference on Advanced Computing and Analytics (ACOMPA), Advanced Computing and Analytics (ACOMPA), 2025 19th International Conference on, ACOMPA, 2025",,EBSCO,,0,
EBSCO_3137204300684603117,"Human to Document, AI to Code: Comparing GenAI for Notebook Competitions","Settewong, Tasha; Fan, Youmei; Kula, Raula Gaikovina; Computing and Processing; Measurement; Technological innovation; Codes",2025,"Publicaciones arbitradas
Ponencia de conferencia
Herramientas para Human to Document, AI to Code: Comparing GenAI for Notebook Competitions
Human to Document, AI to Code: Comparing GenAI for Notebook Competitions",Computing and Processing; Measurement; Technological innovation; Codes,"2025 2nd IEEE/ACM International Conference on AI-powered Software (AIware), AI-powered Software (AIware), 2025 2nd IEEE/ACM International Conference on, AIWARE, 2025",,EBSCO,,0,
EBSCO_-8041005945071725202,Experience Deploying Containerized GenAI Services at an HPC Center,"Beltre, Angel M; Ogden, Jeff; Pedretti, Kevin; Computing and Processing; Cloud computing; Runtime; High performance computing",,"Publicaciones arbitradas
Ponencia de conferencia
Herramientas para Experience Deploying Containerized GenAI Services at an HPC Center
Experience Deploying Containerized GenAI Services at an HPC Center",Computing and Processing; Cloud computing; Runtime; High performance computing,"SC25-W: Workshops of the International Conference for High Performance Computing, Networking, Storage and Analysis, High Performance Computing, Networking, Storage and Analysis, SC25-W: Workshops of the International Conference for, 2025",,EBSCO,,0,
EBSCO_-372598269900951461,GenAI Game Theory Analysis of Computational Offloading and Resource Management in Vehicular Networks,"Jahan, Nusrat; Hasan, Mohammad Kamrul; Ahmad Nazri, Mohd Zakree; Bioengineering; Communication, Networking and Broadcast Technologies; Components, Circuits, Devices and Systems; Computing and Processing",2025,"Publicaciones arbitradas
Ponencia de conferencia
Herramientas para GenAI Game Theory Analysis of Computational Offloading and Resource Management in Vehicular Networks
GenAI Game Theory Analysis of Computational Offloading and Resource Management in Vehicular Networks","Bioengineering; Communication, Networking and Broadcast Technologies; Components, Circuits, Devices and Systems; Computing and Processing","2025 International Conference on Electrical Engineering and Informatics (ICEEI), Electrical Engineering and Informatics (ICEEI), 2025 International Conference on, 2025",,EBSCO,,0,
EBSCO_-1115582853829316796,Empowering GenAI with SMCKI Collaborative Script in CSCL to Enhance Undergraduate Students' Collaborative Problem-Solving Ability and Learning Performance,"Wei, Ziwen; Zhang, Yi; Ding, Shuangting; Computing and Processing; Spirals; Federated learning; Collaboration",2025,"Publicaciones arbitradas
Ponencia de conferencia
Herramientas para Empowering GenAI with SMCKI Collaborative Script in CSCL to Enhance Undergraduate Students' Collaborative Problem-Solving Ability and Learning Performance
Empowering GenAI with SMCKI Collaborative Script in CSCL to Enhance Undergraduate Students' Collaborative Problem-Solving Ability and Learning Performance",Computing and Processing; Spirals; Federated learning; Collaboration,"2025 International Conference on Educational Technology Management (ICETM), Educational Technology Management (ICETM), 2025 International Conference on, 2025",,EBSCO,,0,
EBSCO_-6142278140698021021,How Generative Artificial Intelligence Empowers Teaching: A Systematic Literature Review of Empirical Evidence from China,"Li, Jihong; Wang, Huaibo; Chen, Peng; Computing and Processing; Ethics; Generative AI; Pain",2025,"Publicaciones arbitradas
Ponencia de conferencia
Herramientas para How Generative Artificial Intelligence Empowers Teaching: A Systematic Literature Review of Empirical Evidence from China
How Generative Artificial Intelligence Empowers Teaching: A Systematic Literature Review of Empirical Evidence from China",Computing and Processing; Ethics; Generative AI; Pain,"2025 International Conference on Educational Technology Management (ICETM), Educational Technology Management (ICETM), 2025 International Conference on, 2025",,EBSCO,,0,
EBSCO_-3835169719196616073,GenAI-Driven Smart Hiring Platform,"Indugu, Veera Venkata Raghunath; Putty, Lahari; Chandra, Saurabh; Communication, Networking and Broadcast Technologies; Components, Circuits, Devices and Systems; Computing and Processing; Engineering Profession",2025,"Publicaciones arbitradas
Ponencia de conferencia
Herramientas para GenAI-Driven Smart Hiring Platform
GenAI-Driven Smart Hiring Platform","Communication, Networking and Broadcast Technologies; Components, Circuits, Devices and Systems; Computing and Processing; Engineering Profession","2025 International Conference on Future Technologies (ICFT), Future Technologies (ICFT), 2025 International Conference on, 2025",,EBSCO,,0,
EBSCO_-2149862311734057830,Generative Artificial Intelligence-Guided Quantum Group Consensus Based on Incentive Behavioral Optimization Under Multi-Scale Environments for Consumer Electronics in Smart Cities,"Power, Energy and Industry Applications; Components, Circuits, Devices and Systems; Fields, Waves and Electromagnetics; Government",2026,"Publicaciones arbitradas
Publicación académica
Herramientas para Generative Artificial Intelligence-Guided Quantum Group Consensus Based on Incentive Behavioral Optimization Under Multi-Scale Environments for Consumer Electronics in Smart Cities
Generative Artificial Intelligence-Guided Quantum Group Consensus Based on Incentive Behavioral Optimization Under Multi-Scale Environments for Consumer Electronics in Smart Cities","Power, Energy and Industry Applications; Components, Circuits, Devices and Systems; Fields, Waves and Electromagnetics; Government","IEEE Transactions on Consumer Electronics, Consumer Electronics, IEEE Transactions on, IEEE Trans",,EBSCO,,0,
EBSCO_2672295181139304338,Consumer Evaluations of Generative Artificial Intelligence Disclosures in Responses to Health Care Reviews.,"Mousavi, Javad; Villanova, Daniel; Generative artificial intelligence; Disclosure; Consumers' reviews; Medical care",,"Publicaciones arbitradas
Publicación académica
Herramientas para Consumer Evaluations of Generative Artificial Intelligence Disclosures in Responses to Health Care Reviews.
Consumer Evaluations of Generative Artificial Intelligence Disclosures in Responses to Health Care Reviews.",Generative artificial intelligence; Disclosure; Consumers' reviews; Medical care,"Journal of Public Policy & Marketing, Jan",,EBSCO,,0,
EBSCO_5754350832800463699,The Emergence of Generative Artificial Intelligence (GAI) in Higher Education: A Focus Group Discussion (FGD) on the Utilization of GAI to Enhance Academic Activities,"Arista, Artika; Niqotaini, Zatin; Theresiawati; Communication, Networking and Broadcast Technologies; Components, Circuits, Devices and Systems; Computing and Processing; Robotics and Control Systems",2025,"Publicaciones arbitradas
Ponencia de conferencia
Herramientas para The Emergence of Generative Artificial Intelligence (GAI) in Higher Education: A Focus Group Discussion (FGD) on the Utilization of GAI to Enhance Academic Activities
The Emergence of Generative Artificial Intelligence (GAI) in Higher Education: A Focus Group Discussion (FGD) on the Utilization of GAI to Enhance Academic Activities","Communication, Networking and Broadcast Technologies; Components, Circuits, Devices and Systems; Computing and Processing; Robotics and Control Systems","2025 International Conference on Informatics, Multimedia, Cyber and Information System (ICIMCIS), Informatics, Multimedia, Cyber and Information System (ICIMCIS), 2025 International Conference on, 2025",,EBSCO,,0,
EBSCO_4703648334118249748,Research on the Impact of Generative Artificial Intelligence on Middle School Students' Programming Knowledge Mastery and Computational Thinking,"Tian, Hao; Li, Xiaobin; Ren, Jie; Computing and Processing; Codes; Generative AI; Computational modeling",2025,"Publicaciones arbitradas
Ponencia de conferencia
Herramientas para Research on the Impact of Generative Artificial Intelligence on Middle School Students' Programming Knowledge Mastery and Computational Thinking
Research on the Impact of Generative Artificial Intelligence on Middle School Students' Programming Knowledge Mastery and Computational Thinking",Computing and Processing; Codes; Generative AI; Computational modeling,"2025 International Conference on Educational Technology Management (ICETM), Educational Technology Management (ICETM), 2025 International Conference on, 2025",,EBSCO,,0,
EBSCO_8166330659686993004,An Empirical Study on the Impact of Generative Artificial Intelligence-Assisted Programming on Computational Thinking in Secondary School Students,"Guo, Rong; Miao, Haifei; Li, Guian; Computing and Processing; Generative AI; Educational technology; Interviews",2025,"Publicaciones arbitradas
Ponencia de conferencia
Herramientas para An Empirical Study on the Impact of Generative Artificial Intelligence-Assisted Programming on Computational Thinking in Secondary School Students
An Empirical Study on the Impact of Generative Artificial Intelligence-Assisted Programming on Computational Thinking in Secondary School Students",Computing and Processing; Generative AI; Educational technology; Interviews,"2025 International Conference on Educational Technology Management (ICETM), Educational Technology Management (ICETM), 2025 International Conference on, 2025",,EBSCO,,0,
EBSCO_-4566154235770173982,Innovations in Judging Quality of Student Learning: Comparing Human Professionals to GenAI.,"Goodnight, Janelle; Lo, May H.; DiSabito Jr., David M.; Generative artificial intelligence; Educational evaluation; Peer review of students; Evaluation methodology",2024,"Publicaciones arbitradas
Publicación académica
Herramientas para Innovations in Judging Quality of Student Learning: Comparing Human Professionals to GenAI.
Innovations in Judging Quality of Student Learning: Comparing Human Professionals to GenAI.",Generative artificial intelligence; Educational evaluation; Peer review of students; Evaluation methodology,"Business Education Innovation Journal, Dec",,EBSCO,,0,
EBSCO_-4867279505975025370,GenAI in Service-learning: Micro Assessing Higher Order Skills.,"Kimmel, Sara B.; Generative artificial intelligence; Service learning; Undergraduate education; Critical thinking",2024,"Publicaciones arbitradas
Publicación académica
Herramientas para GenAI in Service-learning: Micro Assessing Higher Order Skills.
GenAI in Service-learning: Micro Assessing Higher Order Skills.",Generative artificial intelligence; Service learning; Undergraduate education; Critical thinking,"Business Education Innovation Journal, Dec",,EBSCO,,0,
EBSCO_-7772677766773243718,Prevalence and Characteristics of Generative Artificial Intelligence Policies in Vascular Surgery Journals: A Cross-Sectional Review,John Y. Ha; Cross-Sectional Studies; Generative Artificial Intelligence; Artificial Intelligence; Humans,2026,"Publicación académica
Herramientas para Prevalence and Characteristics of Generative Artificial Intelligence Policies in Vascular Surgery Journals: A Cross-Sectional Review
Prevalence and Characteristics of Generative Artificial Intelligence Policies in Vascular Surgery Journals: A Cross-Sectional Review",Cross-Sectional Studies; Generative Artificial Intelligence; Artificial Intelligence; Humans,"Annals of Vascular Surgery,",,EBSCO,,0,
EBSCO_-2034286606721084810,GenAI for Automated Assessment and Feedback in VR Procedural Training: An Exploratory Study in Cervical Spine Surgery Training,"Fan, Pak Ming; Zhuang, Yipeng; Wu, Zhaolong; Bioengineering; Computing and Processing; Engineering Profession; General Topics for Engineers",2025,"Publicaciones arbitradas
Ponencia de conferencia
Herramientas para GenAI for Automated Assessment and Feedback in VR Procedural Training: An Exploratory Study in Cervical Spine Surgery Training
GenAI for Automated Assessment and Feedback in VR Procedural Training: An Exploratory Study in Cervical Spine Surgery Training",Bioengineering; Computing and Processing; Engineering Profession; General Topics for Engineers,"2025 IEEE International Conference on Teaching, Assessment, and Learning for Engineering (TALE), Teaching, Assessment, and Learning for Engineering (TALE), 2025 IEEE International Conference on, 2025",,EBSCO,,0,
