id,title,authors,year,abstract,keywords,journal,doi,source_db,country,citations,url
EBSCO_1246131092861379085,GenAI-Powered Multilingual Digital Human: An Intelligent Conversational Companion for Enhancing Elderly Mental and Emotional Well-being,"Deshpande, Sanika; Kelkar, Supriya; Bioengineering; Communication, Networking and Broadcast Technologies; Computing and Processing; Engineering Profession",2025,"Publicaciones arbitradas
Ponencia de conferencia
Herramientas para GenAI-Powered Multilingual Digital Human: An Intelligent Conversational Companion for Enhancing Elderly Mental and Emotional Well-being
GenAI-Powered Multilingual Digital Human: An Intelligent Conversational Companion for Enhancing Elderly Mental and Emotional Well-being","Bioengineering; Communication, Networking and Broadcast Technologies; Computing and Processing; Engineering Profession","2025 International Conference on Sustainable Technologies for Humanity and Smart World (HSWTech), Sustainable Technologies for Humanity and Smart World (HSWTech), 2025 International Conference on, 2025",,EBSCO,,0,
EBSCO_7545522987306361222,Advancing Academic Research through Artificial Intelligence Driven Innovation and Gen AI Application,"Kamath, R. S.; Naik, P.G.; Jamsandekar, S. S.; Communication, Networking and Broadcast Technologies; Computing and Processing; Engineering Profession; General Topics for Engineers",2025,"Publicaciones arbitradas
Ponencia de conferencia
Herramientas para Advancing Academic Research through Artificial Intelligence Driven Innovation and Gen AI Application
Advancing Academic Research through Artificial Intelligence Driven Innovation and Gen AI Application","Communication, Networking and Broadcast Technologies; Computing and Processing; Engineering Profession; General Topics for Engineers","2025 World Skills Conference on Universal Data Analytics and Sciences (WorldSUAS), Universal Data Analytics and Sciences (WorldSUAS), 2025 World Skills Conference on, 2025",,EBSCO,,0,
EBSCO_-1488585912098798212,A Framework for Gen AI Adoption for Enterprises Leveraging Enterprise Architecture Patterns,"Wairagade, Anant; Govindarajan, Vijay; Communication, Networking and Broadcast Technologies; Computing and Processing; Robotics and Control Systems; Training",2025,"Publicaciones arbitradas
Ponencia de conferencia
Herramientas para A Framework for Gen AI Adoption for Enterprises Leveraging Enterprise Architecture Patterns
A Framework for Gen AI Adoption for Enterprises Leveraging Enterprise Architecture Patterns","Communication, Networking and Broadcast Technologies; Computing and Processing; Robotics and Control Systems; Training","2025 IEEE 7th Symposium on Computers & Informatics (ISCI), Computers & Informatics (ISCI), 2025 IEEE 7th Symposium on, 2025",,EBSCO,,0,
EBSCO_117805239147674160,"GenAI-based Mental Health Chatbots: Efficacy, Personalization and Ethical Considerations","Surana, Kaushal; Sharma, Aditya; Tibrewal, Vatsal; Bioengineering; Communication, Networking and Broadcast Technologies; Computing and Processing; General Topics for Engineers",2025,"Publicaciones arbitradas
Ponencia de conferencia
Herramientas para GenAI-based Mental Health Chatbots: Efficacy, Personalization and Ethical Considerations
GenAI-based Mental Health Chatbots: Efficacy, Personalization and Ethical Considerations","Bioengineering; Communication, Networking and Broadcast Technologies; Computing and Processing; General Topics for Engineers","2025 Seventeenth International Conference on Contemporary Computing (IC3), Contemporary Computing (IC3), 2025 Seventeenth International Conference on, 2025",,EBSCO,,0,
EBSCO_-7255819482713720571,"Navigating GenAI in Malaysian Universities: Use, Problems, and Challenges","Al-kumaim, Nabil Hasan; Hasnah Hassan, Siti; Mohammed, Fathey; Bioengineering; Communication, Networking and Broadcast Technologies; Computing and Processing; Engineered Materials, Dielectrics and Plasmas",2025,"Publicaciones arbitradas
Ponencia de conferencia
Herramientas para Navigating GenAI in Malaysian Universities: Use, Problems, and Challenges
Navigating GenAI in Malaysian Universities: Use, Problems, and Challenges","Bioengineering; Communication, Networking and Broadcast Technologies; Computing and Processing; Engineered Materials, Dielectrics and Plasmas","2025 5th International Conference on Emerging Smart Technologies and Applications (eSmarTA), Emerging Smart Technologies and Applications (eSmarTA), 2025 5th International Conference on, 2025",,EBSCO,,0,
EBSCO_-6133053822619180420,Opportunities and Applications of GenAI in Smart Cities: A User-Centric Survey,"Pradhan, Dipen; Arora, Lakshit; Shetgaonkar, Ankit; Communication, Networking and Broadcast Technologies; Computing and Processing; General Topics for Engineers; Robotics and Control Systems",2025,"Publicaciones arbitradas
Ponencia de conferencia
Herramientas para Opportunities and Applications of GenAI in Smart Cities: A User-Centric Survey
Opportunities and Applications of GenAI in Smart Cities: A User-Centric Survey","Communication, Networking and Broadcast Technologies; Computing and Processing; General Topics for Engineers; Robotics and Control Systems","2025 IEEE International Conference on Omni-layer Intelligent Systems (COINS), Omni-layer Intelligent Systems (COINS), 2025 IEEE International Conference on, 2025",,EBSCO,,0,
EBSCO_2361603774460970219,Clinical Reach into the Cognitive Space (CRITiCS): outline conceptual framework for safe use of generative artificial intelligence in mental health decision-making.,"Needle, Jacob; Generative artificial intelligence; Clinical decision making; Medical logic; Language models",,"Publicaciones arbitradas
Publicación académica
Herramientas para Clinical Reach into the Cognitive Space (CRITiCS): outline conceptual framework for safe use of generative artificial intelligence in mental health decision-making.
Clinical Reach into the Cognitive Space (CRITiCS): outline conceptual framework for safe use of generative artificial intelligence in mental health decision-making.",Generative artificial intelligence; Clinical decision making; Medical logic; Language models,"BJPsych Bulletin, Apr",,EBSCO,,0,
EBSCO_2736420375258408767,Prevalence of generative artificial intelligence sexualized image usage by adolescents in the United States.,Generative artificial intelligence; Teenagers; Educational law & legislation; Social processes,2026,"Publicaciones arbitradas
Publicación académica
Herramientas para Prevalence of generative artificial intelligence sexualized image usage by adolescents in the United States.
Prevalence of generative artificial intelligence sexualized image usage by adolescents in the United States.",Generative artificial intelligence; Teenagers; Educational law & legislation; Social processes,"PLoS ONE, 3/18/",,EBSCO,,0,
EBSCO_9071015110494431741,Investigating the correlation between candidate teachers' acceptance of generative artificial intelligence and artificial intelligence literacy across various disciplines.,"Arık Karamık, Gözdegül; Özkaya, Ali; Generative artificial intelligence; Teacher education; Machine learning; Artificial intelligence & ethics",2026,"Publicaciones arbitradas
Publicación académica
Herramientas para Investigating the correlation between candidate teachers' acceptance of generative artificial intelligence and artificial intelligence literacy across various disciplines.
Investigating the correlation between candidate teachers' acceptance of generative artificial intelligence and artificial intelligence literacy across various disciplines.",Generative artificial intelligence; Teacher education; Machine learning; Artificial intelligence & ethics,"PLoS ONE, 3/5/",,EBSCO,,0,
EBSCO_-4438340513620151649,"A Strengths, Weaknesses, Opportunities, and Threats Analysis of Generative Artificial Intelligence in Aphasia Management With Proposed Ethical Guidelines.",Generative artificial intelligence; Medical protocols; Documentation; Health services accessibility,,"Publicaciones arbitradas
Publicación académica
Herramientas para A Strengths, Weaknesses, Opportunities, and Threats Analysis of Generative Artificial Intelligence in Aphasia Management With Proposed Ethical Guidelines.
A Strengths, Weaknesses, Opportunities, and Threats Analysis of Generative Artificial Intelligence in Aphasia Management With Proposed Ethical Guidelines.",Generative artificial intelligence; Medical protocols; Documentation; Health services accessibility,"American Journal of Speech-Language Pathology, Mar",,EBSCO,,0,
EBSCO_3649256566454247789,Can generative artificial intelligence enhance evidence-based and personalized medicine?,Generative artificial intelligence; Individualized medicine; Medical protocols; Evidence-based medicine,2026,"Publicaciones arbitradas
Publicación académica
Herramientas para Can generative artificial intelligence enhance evidence-based and personalized medicine?
Can generative artificial intelligence enhance evidence-based and personalized medicine?",Generative artificial intelligence; Individualized medicine; Medical protocols; Evidence-based medicine,"PLoS Medicine, 2/17/",,EBSCO,,0,
