id,title,authors,year,abstract,keywords,journal,doi,source_db,country,citations,url
EBSCO_-2498856327756280586,Gen AI Based Placement Prepration Platform-Prepto,"Bansal, Riya; Mittal, Punit; Gupta, Sneha; Communication, Networking and Broadcast Technologies; Components, Circuits, Devices and Systems; General Topics for Engineers; Engineering profession",2025,"Publicaciones arbitradas
Ponencia de conferencia
Herramientas para Gen AI Based Placement Prepration Platform-Prepto
Gen AI Based Placement Prepration Platform-Prepto","Communication, Networking and Broadcast Technologies; Components, Circuits, Devices and Systems; General Topics for Engineers; Engineering profession","2025 2nd International Conference on Advanced Computing and Emerging Technologies (ACET), Advanced Computing and Emerging Technologies (ACET), 2025 2nd International Conference on, 2025",,EBSCO,,0,
EBSCO_-8242895238849151045,GenAI-Empowered Network Evolution: Performance Analysis of AF and DF Relaying Systems over Dual-Hop Wireless Networks Under κ-μ Fading Case Study.,Decode & forward communication; Generative artificial intelligence; Bit error rate; Quadrature phase shift keying,,"Publicaciones arbitradas
Publicación académica
Herramientas para GenAI-Empowered Network Evolution: Performance Analysis of AF and DF Relaying Systems over Dual-Hop Wireless Networks Under κ-μ Fading Case Study.
GenAI-Empowered Network Evolution: Performance Analysis of AF and DF Relaying Systems over Dual-Hop Wireless Networks Under κ-μ Fading Case Study.",Decode & forward communication; Generative artificial intelligence; Bit error rate; Quadrature phase shift keying,"Sensors (14248220), Feb",,EBSCO,,0,
EBSCO_1508382427235806315,A Generative AI-Driven Industrial Design Framework for Human–GenAI Co-Creation.,"Chen, Chen; Cheng, Fangmin; Zhang, Boyi; Industrial design; Generative artificial intelligence; Documentation; Three-dimensional modeling",,"Publicaciones arbitradas
Publicación académica
Herramientas para A Generative AI-Driven Industrial Design Framework for Human–GenAI Co-Creation.
A Generative AI-Driven Industrial Design Framework for Human–GenAI Co-Creation.",Industrial design; Generative artificial intelligence; Documentation; Three-dimensional modeling,"Symmetry (20738994), Feb",,EBSCO,,0,
EBSCO_-2903802754720721772,Re-Imagining Marketing Education for Career Readiness in the GenAI Era.,Generative artificial intelligence; Marketing education; Marketing research; Job skills,,"Publicaciones arbitradas
Publicación académica
Herramientas para Re-Imagining Marketing Education for Career Readiness in the GenAI Era.
Re-Imagining Marketing Education for Career Readiness in the GenAI Era.",Generative artificial intelligence; Marketing education; Marketing research; Job skills,"Journal of Marketing Education, Aug",,EBSCO,,0,
EBSCO_-2020003075442229191,RAISE: A New Method to Develop Experimental Stimuli for Advertising Research with Image Generative Artificial Intelligence.,Generative artificial intelligence; Visual perception; Manipulation checks (Research); Research personnel,,"Publicaciones arbitradas
Publicación académica
Herramientas para RAISE: A New Method to Develop Experimental Stimuli for Advertising Research with Image Generative Artificial Intelligence.
RAISE: A New Method to Develop Experimental Stimuli for Advertising Research with Image Generative Artificial Intelligence.",Generative artificial intelligence; Visual perception; Manipulation checks (Research); Research personnel,"Journal of Advertising, Dec",,EBSCO,,0,
EBSCO_-5659966384362519952,Attention Allocation in L2 Learners’ Writing Feedback: Eye-Tracking Contrasts Between GenAI and Teacher Multidimensional Feedback,"Cao, Xueyan; Chen, Ziqi; Wei, Wei; Computing and Processing; Vocabulary; Generative AI; Interactive systems",2025,"Publicaciones arbitradas
Ponencia de conferencia
Herramientas para Attention Allocation in L2 Learners’ Writing Feedback: Eye-Tracking Contrasts Between GenAI and Teacher Multidimensional Feedback
Attention Allocation in L2 Learners’ Writing Feedback: Eye-Tracking Contrasts Between GenAI and Teacher Multidimensional Feedback",Computing and Processing; Vocabulary; Generative AI; Interactive systems,"2025 5th International Conference on Educational Technology (ICET), Educational Technology (ICET), 2025 5th International Conference on, 2025",,EBSCO,,0,
EBSCO_-4662048672704262281,Navigating the New Landscape: A Conceptual Model for Project-Based Assessment (PBA) in the Age of GenAI,"Kadel, Rajan; Shailendra, Samar; Saxena, Urvashi Rahul; Bioengineering; Computing and Processing; Engineering Profession; General Topics for Engineers",2025,"Publicaciones arbitradas
Ponencia de conferencia
Herramientas para Navigating the New Landscape: A Conceptual Model for Project-Based Assessment (PBA) in the Age of GenAI
Navigating the New Landscape: A Conceptual Model for Project-Based Assessment (PBA) in the Age of GenAI",Bioengineering; Computing and Processing; Engineering Profession; General Topics for Engineers,"2025 World Engineering Education Forum - Global Engineering Deans Council (WEEF-GEDC), Engineering Education Forum - Global Engineering Deans Council (WEEF-GEDC), 2025 World, 2025",,EBSCO,,0,
EBSCO_8818883185971981091,GenAI and Academic Integrity in Dialogue: Pros and Cons,"Adamyk, Oksana; Communication, Networking and Broadcast Technologies; Components, Circuits, Devices and Systems; Computing and Processing; Robotics and Control Systems",2025,"Publicaciones arbitradas
Ponencia de conferencia
Herramientas para GenAI and Academic Integrity in Dialogue: Pros and Cons
GenAI and Academic Integrity in Dialogue: Pros and Cons","Communication, Networking and Broadcast Technologies; Components, Circuits, Devices and Systems; Computing and Processing; Robotics and Control Systems","2025 15th International Conference on Advanced Computer Information Technologies (ACIT), Advanced Computer Information Technologies (ACIT), 2025 15th International Conference on, 2025",,EBSCO,,0,
EBSCO_2270344246742862074,Unlocking On-Chain Intelligence: A Practical Framework for GenAI-Powered Smart Contracts,"Karanjai, Rabimba; Lu, Yang; Xu, Lei; Communication, Networking and Broadcast Technologies; Industries; Runtime; Generative AI",2025,"Publicaciones arbitradas
Ponencia de conferencia
Herramientas para Unlocking On-Chain Intelligence: A Practical Framework for GenAI-Powered Smart Contracts
Unlocking On-Chain Intelligence: A Practical Framework for GenAI-Powered Smart Contracts","Communication, Networking and Broadcast Technologies; Industries; Runtime; Generative AI","2025 7th Conference on Blockchain Research & Applications for Innovative Networks and Services (BRAINS), Blockchain Research & Applications for Innovative Networks and Services (BRAINS), 2025 7th Conference on, 2025",,EBSCO,,0,
EBSCO_7256027075127592583,Guidelines and frameworks of governance for the adoption of generative artificial intelligence in higher education institutions: a scoping review.,"Gomes, Maria Gabrielle Soares; de OliveiraIi, Karoline; Generative artificial intelligence; Information technology; Standards; Organizational governance",2023,"Publicaciones arbitradas
Publicación académica
Herramientas para Guidelines and frameworks of governance for the adoption of generative artificial intelligence in higher education institutions: a scoping review.
Guidelines and frameworks of governance for the adoption of generative artificial intelligence in higher education institutions: a scoping review.",Generative artificial intelligence; Information technology; Standards; Organizational governance,"Brazilian Journal of Management / Revista de Administração da UFSM, Oct-Dec",,EBSCO,,0,
EBSCO_-3884331599131173857,"The future of GenAI and its adoption throughout the trade lifecycle : Navigating challenges, discerning opportunities and optimising value with AI.","Ritz, Stephane; Generative artificial intelligence; Data analytics; Government regulation; System integration",,"Publicaciones arbitradas
Publicación académica
Herramientas para The future of GenAI and its adoption throughout the trade lifecycle : Navigating challenges, discerning opportunities and optimising value with AI.
The future of GenAI and its adoption throughout the trade lifecycle : Navigating challenges, discerning opportunities and optimising value with AI.",Generative artificial intelligence; Data analytics; Government regulation; System integration,"Journal of Securities Operations & Custody, Autumn-Fall",,EBSCO,,0,
EBSCO_1299100854244459818,Factors influencing generative artificial intelligence adoption in Vietnam's banking sector: an empirical study.,Generative artificial intelligence; Digital transformation; Innovation adoption; Banking industry,2025,"Publicaciones arbitradas
Publicación académica
Herramientas para Factors influencing generative artificial intelligence adoption in Vietnam's banking sector: an empirical study.
Factors influencing generative artificial intelligence adoption in Vietnam's banking sector: an empirical study.",Generative artificial intelligence; Digital transformation; Innovation adoption; Banking industry,"Financial Innovation, 9/24/",,EBSCO,,0,
EBSCO_-6876335749714761240,Generative Artificial Intelligence for Software Development Using ISO/IEC 29110 Basic Profile: Gaps and Opportunities,"Valdivia, J.; Mauricio, D.; Guzman-Jimenez, R.; Aerospace; Bioengineering; Communication, Networking and Broadcast Technologies; Components, Circuits, Devices and Systems",2026,"Publicaciones arbitradas
Publicación académica
Herramientas para Generative Artificial Intelligence for Software Development Using ISO/IEC 29110 Basic Profile: Gaps and Opportunities
Generative Artificial Intelligence for Software Development Using ISO/IEC 29110 Basic Profile: Gaps and Opportunities","Aerospace; Bioengineering; Communication, Networking and Broadcast Technologies; Components, Circuits, Devices and Systems","IEEE Access, Access, IEEE,",,EBSCO,,0,
EBSCO_-3660780293733091647,Employee Response to GenAI: Exploring the Effect of ChatGPT Dependence on Work Effort in a Public Service Context.,Generative artificial intelligence; Job involvement; Teachers; Job performance,2025,"Publicaciones arbitradas
Publicación académica
Herramientas para Employee Response to GenAI: Exploring the Effect of ChatGPT Dependence on Work Effort in a Public Service Context.
Employee Response to GenAI: Exploring the Effect of ChatGPT Dependence on Work Effort in a Public Service Context.",Generative artificial intelligence; Job involvement; Teachers; Job performance,"Public Performance & Management Review,",,EBSCO,,0,
EBSCO_-7778068392338466003,Does generative artificial intelligence reinforce financial performance? The mediating role of governance quality.,"Awwad, Bahaa; Zaid, Mohammad A. A.; Sarea, Adel; Generative artificial intelligence; Financial performance; Emerging markets; Endogeneity (Econometrics)",2026,"Publicaciones arbitradas
Publicación académica
Herramientas para Does generative artificial intelligence reinforce financial performance? The mediating role of governance quality.
Does generative artificial intelligence reinforce financial performance? The mediating role of governance quality.",Generative artificial intelligence; Financial performance; Emerging markets; Endogeneity (Econometrics),"Future Business Journal, 1/22/",,EBSCO,,0,
EBSCO_1328258060775667383,Shock Treatment: Can Generative Artificial Intelligence Defibrillate the Dead Aesthetics of Electricity Infrastructure?,Engineering Profession; General Topics for Engineers; Artificial intelligence; Generative AI,2025,"Publicaciones arbitradas
Publicación académica
Herramientas para Shock Treatment: Can Generative Artificial Intelligence Defibrillate the Dead Aesthetics of Electricity Infrastructure?
Shock Treatment: Can Generative Artificial Intelligence Defibrillate the Dead Aesthetics of Electricity Infrastructure?",Engineering Profession; General Topics for Engineers; Artificial intelligence; Generative AI,"IEEE Transactions on Technology and Society, Technology and Society, IEEE Transactions on, IEEE Trans",,EBSCO,,0,
EBSCO_6002046426815111940,Integrating Gen-AI with RAG for Automating SDG Mapping from Sustainability Report of Organisations,"Arora, Shrey; Mishra, Anmol; Communication, Networking and Broadcast Technologies; Components, Circuits, Devices and Systems; Computing and Processing; Power, Energy and Industry Applications",2025,"Publicaciones arbitradas
Ponencia de conferencia
Herramientas para Integrating Gen-AI with RAG for Automating SDG Mapping from Sustainability Report of Organisations
Integrating Gen-AI with RAG for Automating SDG Mapping from Sustainability Report of Organisations","Communication, Networking and Broadcast Technologies; Components, Circuits, Devices and Systems; Computing and Processing; Power, Energy and Industry Applications","2025 IEEE DELCON - International Conference on Recent Smart Technologies in Engineering for Sustainable Development, Recent Smart Technologies in Engineering for Sustainable Development, 2025 IEEE DELCON - International Conference on, 2025",,EBSCO,,0,
EBSCO_-8463047849165691885,Generative Artificial Intelligence for AgileRE: A Systematic Mapping,"Cornide-Reyes, Hector; Angulo, Victor; Monsalves, Diego; Computing and Processing; Engineering Profession; Transportation; Productivity",2025,"Publicaciones arbitradas
Ponencia de conferencia
Herramientas para Generative Artificial Intelligence for AgileRE: A Systematic Mapping
Generative Artificial Intelligence for AgileRE: A Systematic Mapping",Computing and Processing; Engineering Profession; Transportation; Productivity,"2025 44th International Conference of the Chilean Computer Science Society (SCCC), Chilean Computer Science Society (SCCC), 2025 44th International Conference of the, 2025",,EBSCO,,0,
EBSCO_-877623374139952144,The Impact of Generative Artificial Intelligence on Software Development Teams During the Construction Phase: Systematic Mapping Study,"Aguilar-Lopez, Rodrigo; Sanchez-Garcia, Angel J.; Perez-Arriaga, Juan Carlos; Computing and Processing; Engineering Profession; General Topics for Engineers; Productivity",2025,"Publicaciones arbitradas
Ponencia de conferencia
Herramientas para The Impact of Generative Artificial Intelligence on Software Development Teams During the Construction Phase: Systematic Mapping Study
The Impact of Generative Artificial Intelligence on Software Development Teams During the Construction Phase: Systematic Mapping Study",Computing and Processing; Engineering Profession; General Topics for Engineers; Productivity,"2025 13th International Conference in Software Engineering Research and Innovation (CONISOFT), Software Engineering Research and Innovation (CONISOFT), 2025 13th International Conference in, CONISOFT, 2025",,EBSCO,,0,
EBSCO_7293342479351005803,Action Research on Enhancing Record Keeping with GenAI at The Salvation Army,"Offerman, Tyron; Mol, Manuel; Computing and Processing; Engineering Profession; Transportation; Surveys",2025,"Publicaciones arbitradas
Ponencia de conferencia
Herramientas para Action Research on Enhancing Record Keeping with GenAI at The Salvation Army
Action Research on Enhancing Record Keeping with GenAI at The Salvation Army",Computing and Processing; Engineering Profession; Transportation; Surveys,"2025 IEEE International Conference on Technology Management, Operations and Decisions (ICTMOD), Technology Management, Operations and Decisions (ICTMOD), 2025 IEEE International Conference on, 2025",,EBSCO,,0,
EBSCO_-3031864811516090811,How Much Confidence Do We Have for GenAI-Based Reasoningƒ A Statistical Inference Perspective for Reliability Estimation,"Li, Zhaojun Steven; Tadaka, Kalyan Bhagavan; Cassandro, Rocco; Aerospace; Communication, Networking and Broadcast Technologies; Components, Circuits, Devices and Systems; Computing and Processing",2025,"Publicaciones arbitradas
Ponencia de conferencia
Herramientas para How Much Confidence Do We Have for GenAI-Based Reasoningƒ A Statistical Inference Perspective for Reliability Estimation
How Much Confidence Do We Have for GenAI-Based Reasoningƒ A Statistical Inference Perspective for Reliability Estimation","Aerospace; Communication, Networking and Broadcast Technologies; Components, Circuits, Devices and Systems; Computing and Processing","2025 Global Reliability and Prognostics and Health Management Conference (PHM-Xian), Global Reliability and Prognostics and Health Management Conference (PHM-Xian),",,EBSCO,,0,
EBSCO_-7922313293060624436,Mind the Ethics! The Overlooked Ethical Dimensions of GenAI in Software Modeling Education,"Chakraborty, Shalini; Burgueno, Lola; Moreno, Nathalie; Computing and Processing; Ethics; Generative AI; Education",2025,"Publicaciones arbitradas
Ponencia de conferencia
Herramientas para Mind the Ethics! The Overlooked Ethical Dimensions of GenAI in Software Modeling Education
Mind the Ethics! The Overlooked Ethical Dimensions of GenAI in Software Modeling Education",Computing and Processing; Ethics; Generative AI; Education,"2025 ACM/IEEE 28th International Conference on Model Driven Engineering Languages and Systems Companion (MODELS-C), Model Driven Engineering Languages and Systems Companion (MODELS-C), 2025 ACM/IEEE 28th International Conference on, MODELS-C, 2025",,EBSCO,,0,
EBSCO_-2240553623886098371,The Impact of Generative Artificial Intelligence on Learning Outcomes of College Students: A Meta-Analysis Based on Instructional Design,"Yin, Ping; Yin, Yalin; Zhang, Ying; Computing and Processing; Technological innovation; Generative AI; Education",2025,"Publicaciones arbitradas
Ponencia de conferencia
Herramientas para The Impact of Generative Artificial Intelligence on Learning Outcomes of College Students: A Meta-Analysis Based on Instructional Design
The Impact of Generative Artificial Intelligence on Learning Outcomes of College Students: A Meta-Analysis Based on Instructional Design",Computing and Processing; Technological innovation; Generative AI; Education,"2025 5th International Conference on Educational Technology (ICET), Educational Technology (ICET), 2025 5th International Conference on, 2025",,EBSCO,,0,
EBSCO_5440277596867388380,Generative Artificial Intelligence Enabled STEM Learning: Community Garden Practices and Insights,"Zheng, Dehang; Zhang, Rong; Cheng, Ziyi; Computing and Processing; Surveys; Learning systems; Knowledge engineering",2025,"Publicaciones arbitradas
Ponencia de conferencia
Herramientas para Generative Artificial Intelligence Enabled STEM Learning: Community Garden Practices and Insights
Generative Artificial Intelligence Enabled STEM Learning: Community Garden Practices and Insights",Computing and Processing; Surveys; Learning systems; Knowledge engineering,"2025 5th International Conference on Educational Technology (ICET), Educational Technology (ICET), 2025 5th International Conference on, 2025",,EBSCO,,0,
EBSCO_-3037307348841465483,Can GenAI Help Pre-service Teachers Simplify Texts on Par with Experts?,"Gao, Xuesong; Computing and Processing; Training; Generative AI; Refining",2025,"Publicaciones arbitradas
Ponencia de conferencia
Herramientas para Can GenAI Help Pre-service Teachers Simplify Texts on Par with Experts?
Can GenAI Help Pre-service Teachers Simplify Texts on Par with Experts?",Computing and Processing; Training; Generative AI; Refining,"2025 5th International Conference on Educational Technology (ICET), Educational Technology (ICET), 2025 5th International Conference on, 2025",,EBSCO,,0,
EBSCO_-3995216015886395840,"The Application of Generative Artificial Intelligence in Individualized Education Program for Exceptional Children: Value Connotation, Realistic Challenge and Practical Path","Ai, Jing; Zhang, Xuanyu; Chen, Qi; Computing and Processing; Generative AI; Education; Educational technology",2025,"Publicaciones arbitradas
Ponencia de conferencia
Herramientas para The Application of Generative Artificial Intelligence in Individualized Education Program for Exceptional Children: Value Connotation, Realistic Challenge and Practical Path
The Application of Generative Artificial Intelligence in Individualized Education Program for Exceptional Children: Value Connotation, Realistic Challenge and Practical Path",Computing and Processing; Generative AI; Education; Educational technology,"2025 5th International Conference on Educational Technology (ICET), Educational Technology (ICET), 2025 5th International Conference on, 2025",,EBSCO,,0,
EBSCO_8341521059608097761,Research on Primary School Teachers' Intention to Adopt Generative Artificial Intelligence in Teaching Based on the Technology Acceptance Model,"Zhang, Jing; Yu, Xiaojie; Liu, Lu; Computing and Processing; Training; Technology acceptance model; Generative AI",2025,"Publicaciones arbitradas
Ponencia de conferencia
Herramientas para Research on Primary School Teachers' Intention to Adopt Generative Artificial Intelligence in Teaching Based on the Technology Acceptance Model
Research on Primary School Teachers' Intention to Adopt Generative Artificial Intelligence in Teaching Based on the Technology Acceptance Model",Computing and Processing; Training; Technology acceptance model; Generative AI,"2025 5th International Conference on Educational Technology (ICET), Educational Technology (ICET), 2025 5th International Conference on, 2025",,EBSCO,,0,
EBSCO_8561501157271174412,Evaluation of Flexibility Requirement based on Generative Artificial Intelligence and Production Cost Simulation,"Wang, Xian; Sun, Yi; Ma, Li; Communication, Networking and Broadcast Technologies; Components, Circuits, Devices and Systems; Computing and Processing; Engineered Materials, Dielectrics and Plasmas",2025,"Publicaciones arbitradas
Ponencia de conferencia
Herramientas para Evaluation of Flexibility Requirement based on Generative Artificial Intelligence and Production Cost Simulation
Evaluation of Flexibility Requirement based on Generative Artificial Intelligence and Production Cost Simulation","Communication, Networking and Broadcast Technologies; Components, Circuits, Devices and Systems; Computing and Processing; Engineered Materials, Dielectrics and Plasmas","2025 IEEE International Conference on Smart Power and Energy Technologies (SPET), Smart Power and Energy Technologies (SPET), 2025 IEEE International Conference on, 2025",,EBSCO,,0,
EBSCO_7578117036656385115,Generative Artificial Intelligence Models Use in English Language Teaching,"Eremeeva, Aziza; Communication, Networking and Broadcast Technologies; Computing and Processing; Engineering Profession; Robotics and Control Systems",2025,"Publicaciones arbitradas
Ponencia de conferencia
Herramientas para Generative Artificial Intelligence Models Use in English Language Teaching
Generative Artificial Intelligence Models Use in English Language Teaching","Communication, Networking and Broadcast Technologies; Computing and Processing; Engineering Profession; Robotics and Control Systems","2025 5th International Conference on Technology Enhanced Learning in Higher Education (TELE), Technology Enhanced Learning in Higher Education (TELE), 2025 5th International Conference on, 2025",,EBSCO,,0,
EBSCO_-1205856043341203106,Comparative Analysis of GenAI Models in Problem Solving on the LeetCode Platform,"Zhaxylykov, Asset; Communication, Networking and Broadcast Technologies; Computing and Processing; Robotics and Control Systems; Signal Processing and Analysis",2025,"Publicaciones arbitradas
Ponencia de conferencia
Herramientas para Comparative Analysis of GenAI Models in Problem Solving on the LeetCode Platform
Comparative Analysis of GenAI Models in Problem Solving on the LeetCode Platform","Communication, Networking and Broadcast Technologies; Computing and Processing; Robotics and Control Systems; Signal Processing and Analysis","2025 10th International Conference on Computer Science and Engineering (UBMK), Computer Science and Engineering (UBMK), 2025 10th International Conference on, 2025",,EBSCO,,0,
EBSCO_-5609434318444216084,GenAI-Based Threat Intelligence Model: A Comparative Performance Analysis with Traditional Tools,"Communication, Networking and Broadcast Technologies; Computing and Processing; Robotics and Control Systems; Signal Processing and Analysis",2025,"Publicaciones arbitradas
Ponencia de conferencia
Herramientas para GenAI-Based Threat Intelligence Model: A Comparative Performance Analysis with Traditional Tools
GenAI-Based Threat Intelligence Model: A Comparative Performance Analysis with Traditional Tools","Communication, Networking and Broadcast Technologies; Computing and Processing; Robotics and Control Systems; Signal Processing and Analysis","2025 10th International Conference on Computer Science and Engineering (UBMK), Computer Science and Engineering (UBMK), 2025 10th International Conference on, 2025",,EBSCO,,0,
EBSCO_7548041204220211272,GenAI-enabled Network Design for the Case of the Outage Probability of a Beaulieu-Xie Wireless Fading Environment with Maximal Ratio Combining,"Communication, Networking and Broadcast Technologies; Computing and Processing; Fields, Waves and Electromagnetics; Photonics and Electrooptics",2025,"Publicaciones arbitradas
Ponencia de conferencia
Herramientas para GenAI-enabled Network Design for the Case of the Outage Probability of a Beaulieu-Xie Wireless Fading Environment with Maximal Ratio Combining
GenAI-enabled Network Design for the Case of the Outage Probability of a Beaulieu-Xie Wireless Fading Environment with Maximal Ratio Combining","Communication, Networking and Broadcast Technologies; Computing and Processing; Fields, Waves and Electromagnetics; Photonics and Electrooptics","2025 International Symposium ELMAR, ELMAR, 2025 International Symposium, 2025",,EBSCO,,0,
