id,title,authors,year,abstract,keywords,journal,doi,source_db,country,citations,url
https://openalex.org/W4407115300,Factors influencing academic staff satisfaction and continuous usage of generative artificial intelligence (GenAI) in higher education,Maria Ijaz Baig; Elaheh Yadegaridehkordi,2025,"Abstract Generative Artificial Intelligence (GenAI) tools hold significant promises for enhancing teaching and learning outcomes in higher education. However, continues usage behavior and satisfaction of educators with GenAI systems are still less explored. Therefore, this study aims to identify factors influencing academic staff satisfaction and continuous GenAI usage in higher education, employing a survey method and analyzing data using Partial Least Squares Structural Equation Modeling (PLS-SEM). This research utilized the Unified Theory of Acceptance and Use of Technology (UTAUT) and the Expectation Confirmation Model (ECM) as its theoretical foundations, while also integrating ethical concerns as a significant factor. Data was collected from a sample of 127 university academic staff through an online survey questionnaire. The study found a positive correlation between effort expectancy, ethical consideration, expectation confirmation, and academic staff satisfaction. However, performance expectancy did not show a positive correlation with satisfaction. Performance expectancy was positively related to the intention to use GenAI tools, while academic staff satisfaction positively influenced the intention to use GenAI. The social influence did not correlate positively with the use of GenAI. Security and privacy were positively associated with staff satisfaction. Facilitation conditions also positively influenced the intention to use GenAI. The findings of this study provide valuable insights for academia and policymakers, guiding the responsible integration of GenAI tools in education while emphasizing factors for policy considerations and developers of GenAI tools.",Expectancy theory; Psychology; Unified theory of acceptance and use of technology; Structural equation modeling; Higher education; Sample (material); Applied psychology; Medical education; Knowledge management; Social psychology; Computer science; Political science,International Journal of Educational Technology in Higher Education,https://doi.org/10.1186/s41239-025-00506-4,ScienceDirect,MY,53,https://openalex.org/W4407115300
https://openalex.org/W4392363583,Generative artificial intelligence: synthetic datasets in dentistry,Fahad Umer; Niha Adnan,2024,"Synthetic data customized to the need of researchers can be produced to train robust AI models. These models, having been trained on such a diverse dataset will be applicable for dissemination across countries. However, there is a need for the limitations associated with SDs to be better understood, and attempts made to overcome those concerns prior to their widespread use.",Generalizability theory; Computer science; Generative grammar; Artificial intelligence; Machine learning; Data science; Subject-matter expert; Generative model; Deep learning; Synthetic data; Scale (ratio),BDJ Open,https://doi.org/10.1038/s41405-024-00198-4,ScienceDirect,PK,36,https://openalex.org/W4392363583
https://openalex.org/W4384561707,Large language models in medicine,Arun James Thirunavukarasu; Darren Shu Jeng Ting; Kabilan Elangovan; Laura Gutiérrez; Ting Fang Tan; Daniel Shu Wei Ting,2023,,Medicine; Computer science; Intensive care medicine; Computational biology; Biology,Nature Medicine,https://doi.org/10.1038/s41591-023-02448-8,ScienceDirect,GB,2985,https://openalex.org/W4384561707
https://openalex.org/W4400658779,Exploring student perspectives on generative artificial intelligence in higher education learning,David Baidoo-Anu; Daniel Asamoah; Isaac Oduro Amoako; Inuusah Mahama,2024,"Abstract This study examined the perspectives of Ghanaian higher education students on the use of ChatGPT. The Students’ ChatGPT Experiences Scale (SCES) was developed and validated to evaluate students’ perspectives of ChatGPT as a learning tool. A total of 277 students from universities and colleges participated in the study. Through exploratory factor analysis, a three-factor structure of students' perspectives (ChatGPT academic benefits, ChatGPT academic concerns, and accessibility and attitude towards ChatGPT) was identified. A confirmatory factor analysis was carried out to confirm the identified factors. The majority of students are aware of and recognize the potential of Gen AI tools like ChatGPT in supporting their learning. However, a significant number of students reported using ChatGPT mainly for non-academic purposes, citing concerns such as academic policy violations, excessive reliance on technology, lack of originality in assignments, and potential security risks. Students mainly use ChatGPT for assignments rather than for class or group projects. Students noted that they have not received any training on how to use ChatGPT safely and effectively. The implications for policy and practice are discussed in terms of how well-informed policy guidelines and strategies on the use of Gen AI tools like ChatGPT can support teaching and improve student learning.",Generative grammar; Mathematics education; Psychology; Artificial intelligence; Computer science; Cognitive science,Discover Education,https://doi.org/10.1007/s44217-024-00173-z,ScienceDirect,CA,48,https://openalex.org/W4400658779
https://openalex.org/W4404223100,Disciplinary differences in undergraduate students' engagement with generative artificial intelligence,Yao Qu; Michelle Tan; Jue Wang,2024,"Abstract The rapid development of generative artificial intelligence (GenAI) technologies has sparked widespread discussions about their potential applications in higher education. However, little is known about how students from various disciplines engage with GenAI tools. This study explores undergraduate students' GenAI knowledge, usage intentions, and task-specific engagement across academic disciplines. Using a disciplinary categorization framework, we examine how the hard/soft and pure/applied dimensions relate to students' interactions with GenAI. We surveyed 193 undergraduates from diverse disciplines at a university in Singapore. The questionnaire assessed students' GenAI knowledge, usage intentions, and engagement with GenAI for cognitive and routine tasks against their disciplinary background. The results indicate substantial disciplinary disparities in the level of engagement of students with GenAI. Compared to pure fields, applied fields (both hard and soft) consistently exhibit higher levels of GenAI knowledge and utilization intentions. Furthermore, the engagement of GenAI in routine tasks is relatively consistent across disciplines; however, there are substantial disparities in cognitive tasks, with applied fields exhibiting higher engagement. These results suggest that the practical orientation of applied fields drives GenAI adoption and utilization in academic settings. The study emphasizes considering disciplinary differences to better integrate GenAI into higher education and calls for tailored approaches that align with each field's unique epistemological and methodological traditions to balance GenAI's practical benefits with the preservation of core disciplinary knowledge and skills.",Generative grammar; Discipline; Artificial intelligence; Computer science; Mathematics education; Psychology; Sociology; Social science,Smart Learning Environments,https://doi.org/10.1186/s40561-024-00341-6,ScienceDirect,SG,36,https://openalex.org/W4404223100
https://openalex.org/W4402808883,Generative artificial intelligence (GenAI) and entrepreneurial performance: implications for entrepreneurs,Ailing Liu; Shaofeng Wang,2024,,Generative grammar; Entrepreneurship; Artificial intelligence; Psychology; Business; Computer science; Finance,The Journal of Technology Transfer,https://doi.org/10.1007/s10961-024-10132-3,ScienceDirect,CN,33,https://openalex.org/W4402808883
https://openalex.org/W4405171814,Generative Artificial Intelligence in Mental Healthcare: An Ethical Evaluation,Charlotte Blease; Adam Rodman,2024,"Abstract Purpose Since November 2022, generative artificial intelligence (AI) chatbots, such as ChatGPT, that are powered by large language models (LLM) have been the subject of growing attention in healthcare. Using biomedical ethical principles to frame our discussion, this review seeks to clarify the current ethical implications of these chatbots, and to identify the key empirical questions that should be pursued to inform ethical practice. Recent findings In the past two years, research has been conducted into the capacity of generative AI chatbots to pass medical school examinations, evaluate complex diagnostic cases, solicit patient histories, interpret and summarize clinical documentation, and deliver empathic care. These studies demonstrate the scope and growing potential of this AI to assist with clinical tasks. Summary Despite increasing recognition that generative AI can play a valuable role in assisting with clinical tasks, there has been limited, focused attention paid to the ethical consequences of these technologies for mental healthcare. Adopting a framework of biomedical ethics, this review sought to evaluate the ethics of generative AI tools in mental healthcare, and to motivate further research into the benefits and harms of these tools.",Generative grammar; Psychology; Mental health care; Neurology; Mental health; Health care; Psychiatry; Artificial intelligence; Computer science; Political science,Current Treatment Options in Psychiatry,https://doi.org/10.1007/s40501-024-00340-x,ScienceDirect,SE,28,https://openalex.org/W4405171814
https://openalex.org/W4395044357,Towards Understanding the Interplay of Generative Artificial Intelligence and the Internet,Gonzalo Serrano Martínez; Lauren Watson; Pedro Reviriego; José Alberto Hernández; Marc Juárez; Rik Sarkar,2024,,Generative grammar; Computer science; Generative model; Artificial intelligence; Generative Design; The Internet; Diversity (politics); Data science; Machine learning; World Wide Web,Lecture notes in computer science,https://doi.org/10.1007/978-3-031-57963-9_5,ScienceDirect,ES,28,https://openalex.org/W4395044357
https://openalex.org/W4394986897,The sudden disruptive rise of generative artificial intelligence? An evaluation of their impact on higher education and the global workplace,Wilson Kia Onn Wong,2024,"This paper evaluates the rise of “Generative Artificial Intelligence” (GAI) in its myriad forms, with the highest profile being the “Large Language Models” (LLMs). More importantly, it analyses the potentially disruptive impact of this ascendant technology on higher education and the global workplace. The findings of this paper indicate that students pursuing higher education tend to perceive GAI favourably, as it frees them from the toil of rote-learning. However, the view is rather mixed in the case of educators, who are still coming to grips with this seemingly disruptive technology. In the case of the global labour market, GAI has the potential to decimate legions of white-collar jobs once it eliminates inherent issues of biases, security and misinformation. Despite the media’s constant labelling of GAI as a disruptive technology that has suddenly burst onto the technological scene, it is evidenced in this paper that the technology has taken nearly eight decades to reach today’s level of technological advancement. Further, it is far from reaching its full potential, as it is still incorporating advances in pattern recognition, planning and problem solving, and quantum computing technologies. This study also warns of concentrating the power of this game-changing technology in the hands of a few major corporate titans.",Misinformation; Disruptive innovation; Futures contract; Disruptive technology; Generative grammar; Information and Communications Technology; Emerging technologies; Political science; Engineering; Business; Computer science; Marketing; Economics; Artificial intelligence; Law; Financial economics,Journal of Open Innovation Technology Market and Complexity,https://doi.org/10.1016/j.joitmc.2024.100278,ScienceDirect,HK,42,https://openalex.org/W4394986897
https://openalex.org/W4401894003,Students’ use of generative artificial intelligence for proving mathematical statements,Hyunkyoung Yoon; Jihye Hwang; Kyung Won Lee; Kyeong Hah Roh; Oh Nam Kwon,2024,"Abstract In this exploratory study, we investigate undergraduate students’ engagement with generative Artificial Intelligence (genAI) in proving mathematical statements. We selected six mathematical statements to conduct interviews with three students. We present the emergent framework, Students’ Interactive Proving Experience with AI (SIPE-AI), which explains the processes of students’ use of genAI in their proving and the factors influencing these processes. Our findings identify three factors that shape students’ use of genAI: conceptions of proof, conceptions of genAI, and ethical considerations. The results suggest a need to guide undergraduate students in critically engaging with genAI tools, rather than passively accepting their outputs. We also discuss the implications of these findings for enhancing undergraduate mathematics education by fostering informed and critical use of genAI in mathematical proving.",Generative grammar; Mathematics education; Psychology; Generative model; Artificial intelligence; Computer science,ZDM,https://doi.org/10.1007/s11858-024-01629-0,ScienceDirect,US,26,https://openalex.org/W4401894003
https://openalex.org/W4401843926,Generative artificial intelligence in smart manufacturing,Andrew Kusiak,2024,,Generative grammar; Artificial intelligence; Computer science; Production (economics); Smart manufacturing; Engineering; Manufacturing engineering; Economics,Journal of Intelligent Manufacturing,https://doi.org/10.1007/s10845-024-02480-6,ScienceDirect,US,26,https://openalex.org/W4401843926
https://openalex.org/W4396598438,On the role of generative artificial intelligence in the development of brain-computer interfaces,Seif Eldawlatly,2024,"Since their inception more than 50 years ago, Brain-Computer Interfaces (BCIs) have held promise to compensate for functions lost by people with disabilities through allowing direct communication between the brain and external devices. While research throughout the past decades has demonstrated the feasibility of BCI to act as a successful assistive technology, the widespread use of BCI outside the lab is still beyond reach. This can be attributed to a number of challenges that need to be addressed for BCI to be of practical use including limited data availability, limited temporal and spatial resolutions of brain signals recorded non-invasively and inter-subject variability. In addition, for a very long time, BCI development has been mainly confined to specific simple brain patterns, while developing other BCI applications relying on complex brain patterns has been proven infeasible. Generative Artificial Intelligence (GAI) has recently emerged as an artificial intelligence domain in which trained models can be used to generate new data with properties resembling that of available data. Given the enhancements observed in other domains that possess similar challenges to BCI development, GAI has been recently employed in a multitude of BCI development applications to generate synthetic brain activity; thereby, augmenting the recorded brain activity. Here, a brief review of the recent adoption of GAI techniques to overcome the aforementioned BCI challenges is provided demonstrating the enhancements achieved using GAI techniques in augmenting limited EEG data, enhancing the spatiotemporal resolution of recorded EEG data, enhancing cross-subject performance of BCI systems and implementing end-to-end BCI applications. GAI could represent the means by which BCI would be transformed into a prevalent assistive technology, thereby improving the quality of life of people with disabilities, and helping in adopting BCI as an emerging human-computer interaction technology for general use.",Brain–computer interface; Computer science; Brain activity and meditation; Artificial intelligence; Electroencephalography; Human–computer interaction; Machine learning; Neuroscience; Psychology,BMC Biomedical Engineering,https://doi.org/10.1186/s42490-024-00080-2,ScienceDirect,EG,28,https://openalex.org/W4396598438
https://openalex.org/W4395462649,Analyzing behavioral intentions toward Generative Artificial Intelligence: the case of ChatGPT,Dongyan Nan; Seungjong Sun; Shunan Zhang; Xiangying Zhao; Jang Hyun Kim,2024,,Generative grammar; Computer science; Artificial intelligence; Generative model; Psychology,Universal Access in the Information Society,https://doi.org/10.1007/s10209-024-01116-z,ScienceDirect,KR,28,https://openalex.org/W4395462649
https://openalex.org/W4407979380,Exploring the impact of generative artificial intelligence on students’ learning outcomes: a meta-analysis,Yinkun Zhu; Qiwen Liu; Li Zhao,2025,,Educational technology; Meta-analysis; Generative grammar; Computer science; Psychology; Mathematics education; Artificial intelligence; Generative model; Medicine,Education and Information Technologies,https://doi.org/10.1007/s10639-025-13420-z,ScienceDirect,CN,34,https://openalex.org/W4407979380
https://openalex.org/W4390984202,How will the state think with ChatGPT? The challenges of generative artificial intelligence for public administrations,Thomas Cantens,2024,,Public sector; Transformative learning; Politics; Neutrality; Generative grammar; Sociology; Public relations; Distrust; State (computer science); Law and economics; Political science; Artificial intelligence; Law; Computer science,AI & Society,https://doi.org/10.1007/s00146-023-01840-9,ScienceDirect,FR,32,https://openalex.org/W4390984202
https://openalex.org/W4399616662,Text-to-video generative artificial intelligence: sora in neurosurgery,Ali A. Mohamed; Brandon Lucke‐Wold,2024,,Generative grammar; Neurosurgery; Presentation (obstetrics); Generative model; Motion (physics); Artificial intelligence; Computer science; Medicine; Morphing; Surgery,Neurosurgical Review,https://doi.org/10.1007/s10143-024-02514-w,ScienceDirect,US,26,https://openalex.org/W4399616662
https://openalex.org/W4396694840,Generative artificial intelligence is infiltrating peer review process,Kunming Cheng; Zaijie Sun; Xiaojun Liu; Haiyang Wu; Cheng Li,2024,"Table 1 Statement on AI and AI-assisted technologies in peer review in the top ten journals with the highest impact factor in the field of critical care medicine Journals Statement on AI and AI-assisted technologies in peer review Lancet Respiratory Medicine 1. Reviewers should not use artificial intelligence (AI) or AI-assisted technologies to assist in the scientific review of a paper 2. Reviewers should not upload the paper, or any part of it, into an AI tool 3.",Medicine; Process (computing); Artificial intelligence; Data science; Computer science,Critical Care,https://doi.org/10.1186/s13054-024-04933-z,ScienceDirect,CN,29,https://openalex.org/W4396694840
https://openalex.org/W4385585835,Generative Artificial Intelligence: Opportunities and Challenges of Large Language Models,Fabian Barreto; Lalita Moharkar; Madhura Shirodkar; Vidya Sarode; Saniya Gonsalves; A Johns,2023,,Generative grammar; Computer science; Artificial intelligence; Context (archaeology); World Wide Web; Natural language processing; Geography,Lecture notes in networks and systems,https://doi.org/10.1007/978-981-99-3177-4_41,ScienceDirect,IN,30,https://openalex.org/W4385585835
https://openalex.org/W4401929560,Modelling continuous intention to use generative artificial intelligence as an educational tool among university students: findings from PLS-SEM and ANN,Mohamed Soliman; Reham Adel Ali; Jamshed Khalid; Imran Mahmud; Wanamina Bostan Ali,2024,,Generative grammar; Psychology; Artificial intelligence; Computer science; Mathematics education,Journal of Computers in Education,https://doi.org/10.1007/s40692-024-00333-y,ScienceDirect,TH,51,https://openalex.org/W4401929560
https://openalex.org/W4412535566,Educational impacts of generative artificial intelligence on learning and performance of engineering students in China,Lei Fan; Kuang Kuang Deng; Fangxue Liu,2025,"With the rapid advancement of generative artificial intelligence (AI), its potential applications in higher education have attracted significant attention. This study investigated how 148 students from diverse engineering disciplines and regions across China used generative AI, focusing on its impact on their learning experience and the opportunities and challenges it poses in engineering education. Based on the surveyed data, we explored four key areas: the frequency and application scenarios of AI use among engineering students, its impact on students' learning and performance, commonly encountered challenges in using generative AI, and future prospects for its adoption in engineering education. The results showed that more than half of the participants reported a positive impact of generative AI on their learning efficiency, initiative, and creativity, with nearly half believing it also enhanced their independent thinking. However, despite acknowledging improved study efficiency, many felt their actual academic performance remained largely unchanged and expressed concerns about the accuracy and domain-specific reliability of generative AI. Our findings provide a first-hand insight into the current benefits and challenges generative AI brings to students, particularly Chinese engineering students, while offering several recommendations-especially from the students' perspective-for effectively integrating generative AI into engineering education.",Generative grammar; China; Computer science; Artificial intelligence; Generative model; Data science; Geography,Scientific Reports,https://doi.org/10.1038/s41598-025-06930-w,ScienceDirect,,28,https://openalex.org/W4412535566
https://openalex.org/W4407661387,From Programming to Prompting: Developing Computational Thinking through Large Language Model-Based Generative Artificial Intelligence,Hsiao-Ping Hsu,2025,"Abstract The advancement of large language model-based generative artificial intelligence (LLM-based GenAI) has sparked significant interest in its potential to address challenges in computational thinking (CT) education. CT, a critical problem-solving approach in the digital age, encompasses elements such as abstraction, iteration, and generalisation. However, its abstract nature often poses barriers to meaningful teaching and learning. This paper proposes a constructionist prompting framework that leverages LLM-based GenAI to foster CT development through natural language programming and prompt engineering. By engaging learners in crafting and refining prompts, the framework aligns CT elements with five prompting principles, enabling learners to apply and develop CT in contextual and organic ways. A three-phase workshop is proposed to integrate the framework into teacher education, equipping future teachers to support learners in developing CT through interactions with LLM-based GenAI. The paper concludes by exploring the framework’s theoretical, practical, and social implications, advocating for its implementation and validation.",Generative grammar; Computer science; Computational thinking; Educational technology; Artificial intelligence; Generative model; Cognitive science; Mathematics education; Multimedia; Psychology,TechTrends,https://doi.org/10.1007/s11528-025-01052-6,ScienceDirect,IE,37,https://openalex.org/W4407661387
