id,title,authors,year,abstract,keywords,journal,doi,source_db,country,citations,url
https://openalex.org/W4412094994,Assessing teachers’ generative artificial intelligence competencies: instrument development and validation,Lehong Shi,2025,"Abstract The rapid advancement of generative artificial intelligence (GenAI) technologies presents new opportunities and challenges for educators, necessitating specialized competencies distinct from those required for general AI tools. This study addresses the critical need for a validated instrument to assess teachers’ competencies in effectively and ethically integrating GenAI into educational practice. We developed and validated the Teachers’ GenAI Competencies (T-GAIC) instrument, grounded in a comprehensive review of AI competency frameworks and empirical literature. The instrument comprises five dimensions: (1) Technological proficiency of GenAI, (2) pedagogical compatibility of GenAI in teaching, (3) preparing students with effective practices of GenAI, (4) GenAI-related professional development and communication, and (5) risk and ethical awareness of GenAI in education. Content and face validity were established through expert review and think-aloud protocols with pre-service teachers. Data from 478 pre-service and in-service teachers informed psychometric validation through item discrimination analysis, exploratory factor analysis (EFA), and confirmatory factor analysis (CFA). The final 36-item instrument demonstrated strong internal consistency (Cronbach’s alpha &gt; 0.90), robust construct validity (RMSEA = 0.078, CFI = 0.946, TLI = 0.934), and strong convergent and discriminant validity. The T-GAIC instrument offers a theoretically grounded and empirically validated tool for assessing GenAI competencies, supporting professional development, curriculum design, and educational research on AI integration in teaching and learning.",Educational technology; Generative grammar; Computer science; Psychology; Knowledge management; Mathematics education; Artificial intelligence,Education and Information Technologies,https://doi.org/10.1007/s10639-025-13684-5,ScienceDirect,US,11,https://openalex.org/W4412094994
https://openalex.org/W4411448764,Generative Artificial Intelligence (GAI) in Teaching and Learning Processes at the K-12 Level: A Systematic Review,Daniela Marzano,2025,"This systematic review aims to provide a detailed and comprehensive overview of the use of Generative Artificial Intelligence (GAI) in K-12 education. Using the PRISMA method, this research examined articles published between 2016 and 2024, selecting 197 relevant studies from 5 databases and 2 journals. The methodology included the use of the Mentefacto Map to identify keywords and define inclusion and exclusion criteria, ensuring a systematic and replicable approach. The findings of the review indicate that GAI offers significant opportunities to personalize learning experiences, motivate students, improve assessment methods, and introduce innovative and immersive teaching practices. The use of ChatGPT in educational environments is a clear example of this. There are several critical issues that need attention, such as the need for continuous teacher training on ICT and the development of ministerial guidelines that also address ethical and privacy concerns. There is a notable lack of concrete studies and specific experiments, not only focused on STEM disciplines but also open to the arts/humanities, as well as practical examples of GAI use in daily teaching practices, which should guide educators in selecting the most suitable educational technologies for their teaching objectives. An original contribution of this review lies in identifying specific gaps in the existing literature, along with the proposal of research perspectives and insights that have so far been underexplored.",Generative grammar; Science education; Educational technology; Artificial intelligence; Mathematics education; Computer science; Psychology,Technology Knowledge and Learning,https://doi.org/10.1007/s10758-025-09853-7,ScienceDirect,IT,14,https://openalex.org/W4411448764
https://openalex.org/W4407413581,Navigating anxiety in academia: the role of generative artificial intelligence,Oqab Jabali; Munther Saeedi; Yousef Jaber Alawneh,2025,,Generative grammar; Educational technology; Anxiety; Psychology; Cognitive science; Artificial intelligence; Computer science; Engineering ethics; Pedagogy; Engineering,Education and Information Technologies,https://doi.org/10.1007/s10639-025-13433-8,ScienceDirect,PS,9,https://openalex.org/W4407413581
https://openalex.org/W4400324940,The Role of Generative Artificial Intelligence (GAI) in Education: A Detailed Review for Enhanced Learning Experiences,Tajinder Kumar; Ramesh Kait; Ankita Ankita; Anu Malik,2024,,Generative grammar; Psychology; Cognitive science; Artificial intelligence; Computer science,Lecture notes in electrical engineering,https://doi.org/10.1007/978-981-97-1682-1_17,ScienceDirect,IN,14,https://openalex.org/W4400324940
https://openalex.org/W4408823800,The role of generative artificial intelligence in psychiatric education– a scoping review,Qin Yuan Lee; Michelle Chen; Caroline Ong; Cyrus S. H. Ho,2025,"Despite these promising applications, limitations such as content accuracy, biases, and concerns regarding security and privacy have been highlighted. This study contributes to understanding how GenAI can enhance psychiatric education and suggests future research directions to refine its use in training medical students and primary care physicians. GenAI has significant potential to address the growing demand for mental health professionals, provided its limitations are carefully managed.",Psychology; Medical education; Generative grammar; Medicine; Psychiatry; Artificial intelligence; Computer science,BMC Medical Education,https://doi.org/10.1186/s12909-025-07026-9,ScienceDirect,SG,13,https://openalex.org/W4408823800
https://openalex.org/W4405179644,Generative Artificial Intelligence: Fundamentals and Evolution,Basetty Mallikarjuna; Pushpalatha Chittemsetty,2024,,Generative grammar; Artificial intelligence; Computer science; Machine learning,Studies in computational intelligence,https://doi.org/10.1007/978-981-97-8460-8_1,ScienceDirect,IN,6,https://openalex.org/W4405179644
https://openalex.org/W4401429222,Language discrepancies in the performance of generative artificial intelligence models: an examination of infectious disease queries in English and Arabic,Malik Sallam; Kholoud Al-Mahzoum; Omaima Alshuaib; Hawajer Alhajri; Fatmah Alotaibi; Dalal Alkhurainej; Mohammad Yahya Al-Balwah; Muna Barakat; Jan Egger,2024,"Disparity in AI model performance was noticed between English and Arabic in response to infectious disease queries. This language variation can negatively impact the quality of health content delivered by AI models among native speakers of Arabic. This issue is recommended to be addressed by AI developers, with the ultimate goal of enhancing health outcomes.",Arabic; Natural language processing; Generative grammar; Infectious disease (medical specialty); Computer science; Artificial intelligence; Linguistics; Disease; Medicine; Pathology,BMC Infectious Diseases,https://doi.org/10.1186/s12879-024-09725-y,ScienceDirect,JO,21,https://openalex.org/W4401429222
https://openalex.org/W4408361730,"The AI-mediated communication dilemma: epistemic trust, social media, and the challenge of generative artificial intelligence",Siavosh Sahebi; Paul Formosa,2025,"Abstract The rapid adoption of commercial Generative Artificial Intelligence (Gen AI) products raises important questions around the impact this technology will have on our communicative interactions. This paper provides an analysis of some of the potential implications that Artificial Intelligence-Mediated Communication (AI-MC) may have on epistemic trust in online communications, specifically on social media. We argue that AI-MC poses a risk to epistemic trust being diminished in online communications on both normative and descriptive grounds. Descriptively, AI-MC seems to (roughly) lower levels of epistemic trust. Normatively, we argue that this brings about the following dilemma. On the one hand, there are at least some instances where we should epistemically trust AI-MC less, and therefore the reduction in epistemic trust is justified in these instances. On the other hand, there are also instances where we epistemically trust AI-MC less, but this reduction in epistemic trust is not justified, resulting in discrimination and epistemic injustice in these instances. The difficulty in knowing which of these two groups any instance of AI-MC belongs to brings about the AI-MC dilemma: We must choose between maintaining normal levels of epistemic trust and risking epistemic gullibility when reduced trust is justified, or adopting generally reduced epistemic trust and risking epistemic injustice when such reduced trust is unjustified. Navigating this choice between problematic alternatives creates a significant challenge for social media as an epistemic environment.",Philosophy of language; Metaphysics; Dilemma; Philosophy of science; Epistemology; Generative grammar; Autopoiesis; Social media; Cognitive science; Social epistemology; Psychology; Artificial intelligence; Sociology; Social dilemma; Computer science; Social psychology; Philosophy,Synthese,https://doi.org/10.1007/s11229-025-04963-2,ScienceDirect,AU,14,https://openalex.org/W4408361730
https://openalex.org/W4402079082,Generative Artificial Intelligence in Higher Education: Why the 'Banning Approach' to Student use is Sometimes Morally Justified,Karl de Fine Licht,2024,,Philosophy of technology; Generative grammar; Psychology; Sociology; Engineering ethics; Epistemology; Law; Philosophy of science; Political science; Artificial intelligence; Computer science; Philosophy; Engineering,Philosophy & Technology,https://doi.org/10.1007/s13347-024-00799-9,ScienceDirect,SE,20,https://openalex.org/W4402079082
https://openalex.org/W4400941551,AI-Lab: A Framework for Introducing Generative Artificial Intelligence Tools in Computer Programming Courses,Ethan Dickey; Andres Bejarano; Chirayu Garg,2024,,Generative grammar; Computer science; Artificial intelligence; Computer programming; Software engineering; Programming language,SN Computer Science,https://doi.org/10.1007/s42979-024-03074-y,ScienceDirect,US,17,https://openalex.org/W4400941551
https://openalex.org/W4409375914,"A whole new world, a new fantastic point of view: Charting unexplored territories in consumer research with generative artificial intelligence",Kiwoong Yoo; Michael Haenlein; Kelly Hewett,2025,,Generative grammar; Point (geometry); Artificial intelligence; Sociology; Computer science; Psychology; Mathematics,Journal of the Academy of Marketing Science,https://doi.org/10.1007/s11747-025-01097-2,ScienceDirect,US,16,https://openalex.org/W4409375914
https://openalex.org/W4413821400,Development of the generative artificial intelligence awareness scale for secondary school students in Türkiye,Remziye Semerci; Özkan Özbay; Sevil Çınar Özbay; Selma Durmuş Sarıkahya,2025,,Cronbach's alpha; Construct validity; Confirmatory factor analysis; Scale (ratio); Reliability (semiconductor); Psychology; Context (archaeology); Structural equation modeling; Validity; Psychometrics; Applied psychology; Developmental psychology; Statistics; Mathematics; Cartography,European Journal of Pediatrics,https://doi.org/10.1007/s00431-025-06435-8,ScienceDirect,TR,8,https://openalex.org/W4413821400
https://openalex.org/W4403931061,Reflective Practices and Self-Regulated Learning in Designing with Generative Artificial Intelligence: An Ordered Network Analysis,Ha Nguyen; Andy Nguyen,2024,,Generative grammar; Science education; Educational technology; Artificial intelligence; Computer science; Generative model; Psychology; Mathematics education,Journal of Science Education and Technology,https://doi.org/10.1007/s10956-024-10175-z,ScienceDirect,US,12,https://openalex.org/W4403931061
https://openalex.org/W4409772613,Generative artificial intelligence in physiotherapy education: great potential amidst challenges- a qualitative interview study,Yvonne Lindbäck; Karin Schröder; Torkel Engström; Karin Valeskog; Sofi Sonesson,2025,"Physiotherapy students found GAI beneficial for learning and clinical reasoning but expressed concerns about its impact on learning quality. They emphasized the importance of a critical approach when using GAI and the need for organizational support, including supporting permitted GAI use. Students believed that future advanced GAI models could provide accurate and reliable educational tools and healthcare tools supporting documentation and evidence-based decision-making. However, potential risks include business profit motives and knowledge gaps. Navigating these challenges is essential to fully leveraging GAI's benefits in education and physiotherapy practice. Therefore, fostering a critical approach and ensuring robust organizational support is crucial for maximizing the positive impact of GAI in physiotherapy.",Focus group; Medical education; Qualitative research; Psychology; Health care; Content analysis; Medicine; Sociology,BMC Medical Education,https://doi.org/10.1186/s12909-025-07106-w,ScienceDirect,SE,16,https://openalex.org/W4409772613
https://openalex.org/W4404900839,How to incorporate generative artificial intelligence in nephrology fellowship education,Jing Miao; Charat Thongprayoon; Iasmina Craici; Wisit Cheungpasitporn,2024,"Traditional nephrology education faces challenges due to expanding medical knowledge, case complexity, and personalized learning needs. Generative artificial intelligence (AI), like ChatGPT, offers potential solutions to enhance nephrology education through dynamic, adaptive, and personalized learning experiences. We discuss integrating generative AI into nephrology education at our institution, highlighting its importance and potential applications. It explores how AI can complement traditional teaching methods by addressing challenges like information overload, diverse learning needs, and continuous learning. Generative AI models should be actively utilized under human supervision to ensure accuracy when summarizing key teaching points, creating discussion topics for journal clubs, and aiding in curriculum development for our Nephrology fellowship. Potential future applications include simulation-based learning, interactive learning modules, personalized learning plans, and enhanced research capabilities. AI can also facilitate mentorship, improve assessment, and support administrative tasks. The integration of AI addresses challenges such as keeping pace with knowledge expansion, providing personalized learning experiences, and improving access to expertise. In summary, the integration of generative AI into nephrology education represents a paradigm shift in preparing future kidney specialists. While AI offers numerous benefits, challenges such as data privacy and maintaining the human element in patient care must be addressed. A balanced approach that preserves human mentorship while employing AI's capabilities is crucial for cultivating well-rounded, competent, and compassionate nephrologists ready to tackle future kidney health challenges.",Mentorship; Medicine; Nephrology; Curriculum; Pace; Personalized learning; Artificial intelligence; Medical education; Computer science; Internal medicine; Teaching method; Psychology; Cooperative learning; Pedagogy; Open learning,Journal of Nephrology,https://doi.org/10.1007/s40620-024-02165-6,ScienceDirect,US,8,https://openalex.org/W4404900839
https://openalex.org/W4411829726,International partnership for governing generative artificial intelligence models in medicine,Jasmine Chiat Ling Ong; Yilin Ning; Gary S. Collins; Danielle S. Bitterman; Ashley Beecy; Robert T. Chang; Alastair K. Denniston; Oscar Freyer; Stephen Gilbert; Anne de Hond,2025,,Generative grammar; General partnership; Artificial intelligence; Medicine; Engineering ethics; Computer science; Political science; Engineering; Law,Nature Medicine,https://doi.org/10.1038/s41591-025-03787-4,ScienceDirect,SG,11,https://openalex.org/W4411829726
https://openalex.org/W4409982626,Governing Academic Integrity: Ensuring the Authenticity of Higher Thinking in the Era of Generative Artificial Intelligence,Hamish Coates; Gwilym Croucher; Ángel Calderón,2025,"Abstract There is a pressing need to reform governance of higher education to ensure the academic integrity in response to the contemporary implications of generative artificial intelligence. The aim of this paper is to articulate research which reveals ways in which this can be done. First, it considers what new information would help academic governors improve their work hence academic practice. It presents an academic integrity indicator framework developed through research reviews, multi-institutional case study analysis, framework and data prototyping, qualitative confirmation with experts, and quantitative analysis. Second, it explores reforms to academic governance to ensure uptake and use of such information. The paper articulates reforms to governance architectures, people and technologies/resources, and the need for external pressure from regulation, benchmarking, and cross-institutional competition. The paper concludes by sketching a research agenda for advancing this field.",Generative grammar; Cognitive science; Academic integrity; Psychology; Engineering ethics; Artificial intelligence; Epistemology; Computer science; Engineering; Philosophy,Journal of Academic Ethics,https://doi.org/10.1007/s10805-025-09639-7,ScienceDirect,AU,10,https://openalex.org/W4409982626
https://openalex.org/W4405596710,Generative artificial intelligence attitude analysis of undergraduate students and their precise improvement strategies: A differential analysis of multifactorial influences,Lihui Sun; Liang Zhou,2024,,Generative grammar; Educational technology; Generative model; Psychology; Artificial intelligence; Mathematics education; Computer science; Computer-Assisted Instruction,Education and Information Technologies,https://doi.org/10.1007/s10639-024-13236-3,ScienceDirect,CN,10,https://openalex.org/W4405596710
https://openalex.org/W4401432868,Supercharge Your Academic Productivity with Generative Artificial Intelligence,Hannah Lonsdale; Vikas N. O’Reilly-Shah; Asif Padiyath; Allan F. Simpao,2024,,Supercharge; Health informatics; Productivity; Computer science; Generative grammar; Artificial intelligence; Data science; Public health; Medicine; Mathematics; Economics,Journal of Medical Systems,https://doi.org/10.1007/s10916-024-02093-9,ScienceDirect,US,9,https://openalex.org/W4401432868
https://openalex.org/W4414777793,A generative artificial intelligence approach for the discovery of antimicrobial peptides against multidrug-resistant bacteria,Yihui Wang; Lanlan Zhao; Ziyun Li; Yaxuan Xi; Yingmiao Pan; Guoping Zhao; Lei Zhang,2025,"The discovery of novel antimicrobial peptides (AMPs) against clinical superbugs is urgently needed to address the ongoing antibiotic resistance crisis. AMPs are promising candidates due to their broad-spectrum activity, rapid bactericidal mechanisms and reduced likelihood of inducing resistance compared with conventional antibiotics. Here, a pre-trained protein large language model (LLM), ProteoGPT, was established and further developed into multiple specialized subLLMs to assemble a sequential pipeline. This pipeline enables rapid screening across hundreds of millions of peptide sequences, ensuring potent antimicrobial activity and minimizing cytotoxic risks. Through transfer learning, we endowed the LLMs with different domain-specific knowledge to achieve high-throughput mining and generation of AMPs within a unified methodological framework. Notably, both mined and generated AMPs exhibited reduced susceptibility to resistance development in ICU-derived carbapenem-resistant Acinetobacter baumannii (CRAB) and methicillin-resistant Staphylococcus aureus (MRSA) in vitro. The AMPs also showed comparable or superior therapeutic efficacy in in vivo thigh infection mouse models compared with clinical antibiotics, without causing organ damage and disrupting gut microbiota. The mechanisms of action of these AMPs involve disruption of the cytoplasmic membrane and membrane depolarization. Overall, this study presents a generative artificial intelligence approach for the discovery of novel antimicrobials against multidrug-resistant bacteria, enabling efficient and extensive exploration of AMP space.",Antimicrobial peptides; Acinetobacter baumannii; Antimicrobial; Antibiotic resistance; Antibiotics; Bacteria; Staphylococcus aureus,Nature Microbiology,https://doi.org/10.1038/s41564-025-02114-4,ScienceDirect,CN,11,https://openalex.org/W4414777793
https://openalex.org/W4407342213,Integrating generative artificial intelligence in the design of scientific inquiry for middle school students,Taeho Min; Bongwoo Lee; Hunkoog Jho,2025,,Generative grammar; Educational technology; Science education; Artificial intelligence; Mathematics education; Generative model; Computer science; Cognitive science; Management science; Psychology; Engineering,Education and Information Technologies,https://doi.org/10.1007/s10639-025-13410-1,ScienceDirect,KR,9,https://openalex.org/W4407342213
https://openalex.org/W4407852883,Evaluating the evidence-based potential of six large language models in paediatric dentistry: a comparative study on generative artificial intelligence,Anastasia Dermata; Aristidis Arhakis; Miltiadis A. Makrygiannakis; Kostis Giannakopoulos; Eleftherios G. Kaklamanos,2025,"This study demonstrates the potential use of language models (LLMs) in supporting evidence-based paediatric dentistry. Nevertheless, they cannot be regarded as completely trustworthy. Dental professionals should critically use AI models as supportive tools and not as a substitute of overall scientific knowledge and critical thinking.",Rubric; Reliability (semiconductor); Medicine; Medical education; Psychology; Mathematics education,European Archives of Paediatric Dentistry,https://doi.org/10.1007/s40368-025-01012-x,ScienceDirect,GR,19,https://openalex.org/W4407852883
https://openalex.org/W4407363236,Generative artificial intelligence (GAI) usage guidelines for scholarly publishing: a cross-sectional study of medical journals,Shuhui Yin; Su-Ya Huang; Peng Xue; Zhuoran Xu; Zi Lian; Chenfei Ye; Siyuan Ma; Mingxuan Liu; Hu Y; Peiyi Lu,2025,"Although most medical journals provided their own GAI usage guidelines or referenced external guidelines, some recommendations remained unspecified (e.g., whether AI can be used for data analysis and interpretation). Additionally, journals with lower SJR scores were less likely to provide guidelines, indicating a potential gap that warrants attention. Collaborative efforts are needed to develop specific recommendations that better guide authors and reviewers.",Medicine; Publishing; Sample (material); Scale (ratio); Impact factor; MEDLINE; Sample size determination; Family medicine; Statistics,BMC Medicine,https://doi.org/10.1186/s12916-025-03899-1,ScienceDirect,US,16,https://openalex.org/W4407363236
https://openalex.org/W4405611763,Generative artificial intelligence in management research: a practical guide on mistakes to avoid,Felix Lorenz; Solvej Lorenzen; Matheus Franco; Julius Velz; Thomas Clauß,2024,"Abstract Integrating generative artificial intelligence (AI) into academic research has opened new horizons for enhancing efficiency, accuracy, and innovation in the research process. While recent reviews, conceptualizations, and editorials highlight the potential or provide policy views, we want to give a practical guide on using generative AI in management research and which pitfalls to avoid. We offer five practical tips on what to avoid when using generative AI during the research process. Further, we provide practical guidelines, highlighting AI’s limitations and attempting to provide an outlook on each stage. In doing so, we provide comprehensive guidance on the promises and pitfalls for researchers seeking to leverage AI in the research process.",Generative grammar; Artificial intelligence; Computer science; Management science; Engineering,Management Review Quarterly,https://doi.org/10.1007/s11301-024-00469-2,ScienceDirect,DE,7,https://openalex.org/W4405611763
https://openalex.org/W4390867735,Path planning design for a wheeled robot: a generative artificial intelligence approach,Kailash Kumar Borkar; Mukesh Singh; R. Dasari; Atul Babbar; Anish Pandey; Urja Jain; Pradumn Mishra,2024,,Motion planning; Path (computing); Computer science; Artificial intelligence; Generative grammar; Robot; Heuristic; Robotics; Planner; Generative Design; Engineering,International Journal on Interactive Design and Manufacturing (IJIDeM),https://doi.org/10.1007/s12008-023-01721-x,ScienceDirect,IN,11,https://openalex.org/W4390867735
https://openalex.org/W4393011299,"Complementing Robotic Process Automation with Generative Artificial Intelligence (ChatGPT), Case of Robocorp",Julia Siderska; Suraya Nabilah Binti Mohd Aini; Damian Kedziora,2024,,Generative grammar; Automation; Artificial intelligence; Computer science; Process (computing); Engineering; Manufacturing engineering; Mechanical engineering; Programming language,Lecture notes in networks and systems,https://doi.org/10.1007/978-3-031-53960-2_4,ScienceDirect,PL,11,https://openalex.org/W4393011299
